### DISCUSSION TITLE
Cannot connect to the webserver with docker

### DISCUSSION THREAD

**Discussion by DamienBusson** [apache/airflow#22230] [Q&A]
### Describe the issue with documentation

I have followed this doc to try and run airflow with docker : https://airflow.apache.org/docs/apache-airflow/stable/start/docker.html 

When I run the docker-compose with "docker-compose up", containers are unhealthy and I cannot connect to the webserver.
![Screenshot 2022-03-10 at 16 34 06](https://user-images.githubusercontent.com/77328631/157672486-fbff0d14-4eea-4c13-9794-5218ee787845.jpg)

I know the memory is critical, so I went to Resources and increased it to the maximum I could on my machine.
![Screenshot 2022-03-10 at 16 34 29](https://user-images.githubusercontent.com/77328631/157672560-4045834e-cf46-4760-9ed9-48471b51643d.jpg)

Here are the logs from the terminal:
```
airflow_docker_postgres_1 is up-to-date
airflow_docker_redis_1 is up-to-date
Starting airflow_docker_airflow-init_1 ... done
Creating airflow_docker_airflow-worker_1    ... done
Creating airflow_docker_airflow-triggerer_1 ... done
Creating airflow_docker_airflow-scheduler_1 ... done
Creating airflow_docker_flower_1            ... done
Creating airflow_docker_airflow-webserver_1 ... done
Attaching to airflow_docker_postgres_1, airflow_docker_redis_1, airflow_docker_airflow-init_1, airflow_docker_airflow-worker_1, airflow_docker_airflow-triggerer_1, airflow_docker_airflow-webserver_1, airflow_docker_flower_1, airflow_docker_airflow-scheduler_1
airflow-init_1       | The container is run as root user. For security, consider using a regular user account.
airflow-init_1       | 
airflow-init_1       | /home/airflow/.local/lib/python3.7/site-packages/sqlalchemy/dialects/postgresql/base.py:3573 SAWarning: Predicate of partial index idx_dag_run_queued_dags ignored during reflection
airflow-init_1       | /home/airflow/.local/lib/python3.7/site-packages/sqlalchemy/dialects/postgresql/base.py:3573 SAWarning: Predicate of partial index idx_dag_run_running_dags ignored during reflection
airflow-init_1       | DB: postgresql+psycopg2://airflow:***@postgres/airflow
airflow-init_1       | [2022-03-10 13:14:01,540] {db.py:919} INFO - Creating tables
airflow-init_1       | INFO  [alembic.runtime.migration] Context impl PostgresqlImpl.
airflow-init_1       | INFO  [alembic.runtime.migration] Will assume transactional DDL.
airflow-init_1       | Upgrades done
airflow-init_1       | [2022-03-10 13:14:38,594] {manager.py:512} WARNING - Refused to delete permission view, assoc with role exists DAG Runs.can_create User
airflow-init_1       | airflow already exist in the db
airflow-init_1       | 2.2.4
airflow_docker_airflow-init_1 exited with code 0
postgres_1           | 
postgres_1           | PostgreSQL Database directory appears to contain a database; Skipping initialization
postgres_1           | 
postgres_1           | 2022-03-10 13:11:23.572 UTC [1] LOG:  starting PostgreSQL 13.4 (Debian 13.4-1.pgdg100+1) on x86_64-pc-linux-gnu, compiled by gcc (Debian 8.3.0-6) 8.3.0, 64-bit
postgres_1           | 2022-03-10 13:11:23.573 UTC [1] LOG:  listening on IPv4 address "0.0.0.0", port 5432
postgres_1           | 2022-03-10 13:11:23.573 UTC [1] LOG:  listening on IPv6 address "::", port 5432
postgres_1           | 2022-03-10 13:11:23.601 UTC [1] LOG:  listening on Unix socket "/var/run/postgresql/.s.PGSQL.5432"
postgres_1           | 2022-03-10 13:11:23.624 UTC [26] LOG:  database system was shut down at 2022-03-10 13:10:49 UTC
postgres_1           | 2022-03-10 13:11:23.647 UTC [1] LOG:  database system is ready to accept connections
redis_1              | 1:C 10 Mar 2022 13:11:23.316 # oO0OoO0OoO0Oo Redis is starting oO0OoO0OoO0Oo
redis_1              | 1:C 10 Mar 2022 13:11:23.317 # Redis version=6.2.5, bits=64, commit=00000000, modified=0, pid=1, just started
redis_1              | 1:C 10 Mar 2022 13:11:23.317 # Warning: no config file specified, using the default config. In order to specify a config file use redis-server /path/to/redis.conf
redis_1              | 1:M 10 Mar 2022 13:11:23.323 * monotonic clock: POSIX clock_gettime
redis_1              | 1:M 10 Mar 2022 13:11:23.326 * Running mode=standalone, port=6379.
redis_1              | 1:M 10 Mar 2022 13:11:23.326 # Server initialized
redis_1              | 1:M 10 Mar 2022 13:11:23.330 * Ready to accept connections
flower_1             | 
airflow-webserver_1  | 
flower_1             | BACKEND=redis
flower_1             | DB_HOST=redis
flower_1             | DB_PORT=6379
flower_1             | 
airflow-webserver_1  |   ____________       _____________
airflow-webserver_1  |  ____    |__( )_________  __/__  /________      __
airflow-webserver_1  | ____  /| |_  /__  ___/_  /_ __  /_  __ \_ | /| / /
airflow-webserver_1  | ___  ___ |  / _  /   _  __/ _  / / /_/ /_ |/ |/ /
airflow-webserver_1  |  _/_/  |_/_/  /_/    /_/    /_/  \____/____/|__/
airflow-webserver_1  | [2022-03-10 13:19:06,521] {dagbag.py:500} INFO - Filling up the DagBag from /dev/null
airflow-webserver_1  | [2022-03-10 13:19:19,046] {manager.py:512} WARNING - Refused to delete permission view, assoc with role exists DAG Runs.can_create User
flower_1             | [2022-03-10 13:19:33,035] {command.py:154} INFO - Visit me at http://0.0.0.0:5555
flower_1             | [2022-03-10 13:19:33,750] {command.py:159} INFO - Broker: redis://redis:6379/0
flower_1             | [2022-03-10 13:19:33,803] {command.py:162} INFO - Registered tasks: 
flower_1             | ['airflow.executors.celery_executor.execute_command',
flower_1             |  'celery.accumulate',
flower_1             |  'celery.backend_cleanup',
flower_1             |  'celery.chain',
flower_1             |  'celery.chord',
flower_1             |  'celery.chord_unlock',
flower_1             |  'celery.chunks',
flower_1             |  'celery.group',
flower_1             |  'celery.map',
flower_1             |  'celery.starmap']
flower_1             | [2022-03-10 13:19:34,021] {mixins.py:225} INFO - Connected to redis://redis:6379/0
flower_1             | [2022-03-10 13:19:36,265] {inspector.py:42} WARNING - Inspect method active_queues failed
flower_1             | [2022-03-10 13:19:36,326] {inspector.py:42} WARNING - Inspect method registered failed
flower_1             | [2022-03-10 13:19:36,329] {inspector.py:42} WARNING - Inspect method stats failed
flower_1             | [2022-03-10 13:19:36,482] {inspector.py:42} WARNING - Inspect method revoked failed
flower_1             | [2022-03-10 13:19:36,529] {inspector.py:42} WARNING - Inspect method reserved failed
flower_1             | [2022-03-10 13:19:36,541] {inspector.py:42} WARNING - Inspect method scheduled failed
flower_1             | [2022-03-10 13:19:36,558] {inspector.py:42} WARNING - Inspect method conf failed
flower_1             | [2022-03-10 13:19:36,483] {inspector.py:42} WARNING - Inspect method active failed
airflow-webserver_1  | [2022-03-10 13:20:36 +0000] [193] [INFO] Starting gunicorn 20.1.0
airflow-webserver_1  | [2022-03-10 13:20:36 +0000] [193] [INFO] Listening at: http://0.0.0.0:8080 (193)
airflow-webserver_1  | [2022-03-10 13:20:36 +0000] [193] [INFO] Using worker: sync
airflow-webserver_1  | [2022-03-10 13:20:36 +0000] [210] [INFO] Booting worker with pid: 210
airflow-webserver_1  | [2022-03-10 13:20:36 +0000] [211] [INFO] Booting worker with pid: 211
airflow-webserver_1  | [2022-03-10 13:20:36 +0000] [212] [INFO] Booting worker with pid: 212
airflow-webserver_1  | [2022-03-10 13:20:36 +0000] [213] [INFO] Booting worker with pid: 213
airflow-webserver_1  | [2022-03-10 13:22:37 +0000] [193] [CRITICAL] WORKER TIMEOUT (pid:210)
airflow-webserver_1  | [2022-03-10 13:22:37 +0000] [193] [CRITICAL] WORKER TIMEOUT (pid:211)
airflow-webserver_1  | [2022-03-10 13:22:37 +0000] [193] [CRITICAL] WORKER TIMEOUT (pid:212)
airflow-webserver_1  | [2022-03-10 13:22:37 +0000] [193] [CRITICAL] WORKER TIMEOUT (pid:213)
airflow-webserver_1  | [2022-03-10 13:22:37 +0000] [213] [INFO] Worker exiting (pid: 213)
airflow-webserver_1  | [2022-03-10 13:22:37 +0000] [212] [INFO] Worker exiting (pid: 212)
airflow-webserver_1  | [2022-03-10 13:22:37 +0000] [211] [INFO] Worker exiting (pid: 211)
airflow-webserver_1  | [2022-03-10 13:22:37 +0000] [210] [INFO] Worker exiting (pid: 210)
airflow-webserver_1  | [2022-03-10 13:22:43 +0000] [193] [WARNING] Worker with pid 210 was terminated due to signal 9
airflow-webserver_1  | [2022-03-10 13:22:43 +0000] [193] [WARNING] Worker with pid 212 was terminated due to signal 9
airflow-webserver_1  | [2022-03-10 13:22:43 +0000] [193] [WARNING] Worker with pid 211 was terminated due to signal 9
airflow-webserver_1  | [2022-03-10 13:22:43 +0000] [193] [WARNING] Worker with pid 213 was terminated due to signal 9
airflow-webserver_1  | [2022-03-10 13:22:43 +0000] [268] [INFO] Booting worker with pid: 268
airflow-webserver_1  | [2022-03-10 13:22:43 +0000] [269] [INFO] Booting worker with pid: 269
airflow-webserver_1  | [2022-03-10 13:22:44 +0000] [270] [INFO] Booting worker with pid: 270
airflow-webserver_1  | [2022-03-10 13:22:44 +0000] [271] [INFO] Booting worker with pid: 271
airflow-webserver_1  | [2022-03-10 13:24:43 +0000] [193] [CRITICAL] WORKER TIMEOUT (pid:268)
airflow-webserver_1  | [2022-03-10 13:24:44 +0000] [268] [INFO] Worker exiting (pid: 268)
airflow-webserver_1  | [2022-03-10 13:24:44 +0000] [193] [CRITICAL] WORKER TIMEOUT (pid:269)
airflow-webserver_1  | [2022-03-10 13:24:44 +0000] [193] [CRITICAL] WORKER TIMEOUT (pid:270)
airflow-webserver_1  | [2022-03-10 13:24:44 +0000] [193] [CRITICAL] WORKER TIMEOUT (pid:271)
airflow-webserver_1  | [2022-03-10 13:24:44 +0000] [270] [INFO] Worker exiting (pid: 270)
airflow-webserver_1  | [2022-03-10 13:24:44 +0000] [271] [INFO] Worker exiting (pid: 271)
airflow-webserver_1  | [2022-03-10 13:24:44 +0000] [269] [INFO] Worker exiting (pid: 269)
airflow-webserver_1  | [2022-03-10 13:24:47 +0000] [193] [WARNING] Worker with pid 268 was terminated due to signal 9
airflow-webserver_1  | [2022-03-10 13:24:47 +0000] [193] [WARNING] Worker with pid 270 was terminated due to signal 9
airflow-webserver_1  | [2022-03-10 13:24:47 +0000] [193] [WARNING] Worker with pid 269 was terminated due to signal 9
airflow-webserver_1  | [2022-03-10 13:24:47 +0000] [326] [INFO] Booting worker with pid: 326
airflow-webserver_1  | [2022-03-10 13:24:48 +0000] [325] [INFO] Booting worker with pid: 325
airflow-webserver_1  | [2022-03-10 13:24:48 +0000] [193] [WARNING] Worker with pid 271 was terminated due to signal 9
airflow-webserver_1  | [2022-03-10 13:24:48 +0000] [327] [INFO] Booting worker with pid: 327
airflow-webserver_1  | [2022-03-10 13:24:48 +0000] [328] [INFO] Booting worker with pid: 328
airflow-webserver_1  | [2022-03-10 13:26:47 +0000] [193] [CRITICAL] WORKER TIMEOUT (pid:325)
airflow-webserver_1  | [2022-03-10 13:26:48 +0000] [193] [CRITICAL] WORKER TIMEOUT (pid:326)
airflow-webserver_1  | [2022-03-10 13:26:48 +0000] [193] [CRITICAL] WORKER TIMEOUT (pid:327)
airflow-webserver_1  | [2022-03-10 13:26:48 +0000] [193] [CRITICAL] WORKER TIMEOUT (pid:328)
airflow-webserver_1  | [2022-03-10 13:26:48 +0000] [327] [INFO] Worker exiting (pid: 327)
airflow-webserver_1  | [2022-03-10 13:26:49 +0000] [326] [INFO] Worker exiting (pid: 326)
airflow-webserver_1  | [2022-03-10 13:26:52 +0000] [193] [WARNING] Worker with pid 327 was terminated due to signal 9
airflow-webserver_1  | [2022-03-10 13:26:52 +0000] [193] [WARNING] Worker with pid 326 was terminated due to signal 9
airflow-webserver_1  | [2022-03-10 13:26:52 +0000] [193] [WARNING] Worker with pid 328 was terminated due to signal 9
airflow-webserver_1  | [2022-03-10 13:26:53 +0000] [378] [INFO] Booting worker with pid: 378
airflow-webserver_1  | [2022-03-10 13:26:53 +0000] [377] [INFO] Booting worker with pid: 377
airflow-webserver_1  | [2022-03-10 13:26:53 +0000] [379] [INFO] Booting worker with pid: 379
airflow-webserver_1  | [2022-03-10 13:26:54 +0000] [193] [WARNING] Worker with pid 325 was terminated due to signal 9
airflow-webserver_1  | [2022-03-10 13:26:54 +0000] [380] [INFO] Booting worker with pid: 380
airflow-webserver_1  | [2022-03-10 13:28:52 +0000] [193] [CRITICAL] WORKER TIMEOUT (pid:377)
airflow-webserver_1  | [2022-03-10 13:28:53 +0000] [193] [CRITICAL] WORKER TIMEOUT (pid:378)
airflow-webserver_1  | [2022-03-10 13:28:54 +0000] [193] [CRITICAL] WORKER TIMEOUT (pid:379)
airflow-webserver_1  | [2022-03-10 13:28:54 +0000] [379] [INFO] Worker exiting (pid: 379)
airflow-webserver_1  | [2022-03-10 13:28:55 +0000] [193] [CRITICAL] WORKER TIMEOUT (pid:380)
airflow-webserver_1  | [2022-03-10 13:28:55 +0000] [380] [INFO] Worker exiting (pid: 380)
airflow-webserver_1  | [2022-03-10 13:28:55 +0000] [193] [WARNING] Worker with pid 378 was terminated due to signal 9
airflow-webserver_1  | [2022-03-10 13:28:55 +0000] [193] [WARNING] Worker with pid 379 was terminated due to signal 9
airflow-webserver_1  | [2022-03-10 13:28:55 +0000] [428] [INFO] Booting worker with pid: 428
airflow-webserver_1  | [2022-03-10 13:28:55 +0000] [427] [INFO] Booting worker with pid: 427
airflow-webserver_1  | [2022-03-10 13:28:55 +0000] [193] [WARNING] Worker with pid 377 was terminated due to signal 9
airflow-webserver_1  | [2022-03-10 13:28:56 +0000] [429] [INFO] Booting worker with pid: 429
airflow-webserver_1  | [2022-03-10 13:28:56 +0000] [193] [WARNING] Worker with pid 380 was terminated due to signal 9
airflow-webserver_1  | [2022-03-10 13:28:56 +0000] [430] [INFO] Booting worker with pid: 430
airflow-webserver_1  | [2022-03-10 13:30:56 +0000] [193] [CRITICAL] WORKER TIMEOUT (pid:427)
airflow-webserver_1  | [2022-03-10 13:30:56 +0000] [193] [CRITICAL] WORKER TIMEOUT (pid:428)
airflow-webserver_1  | [2022-03-10 13:30:56 +0000] [193] [CRITICAL] WORKER TIMEOUT (pid:429)
airflow-webserver_1  | [2022-03-10 13:30:56 +0000] [428] [INFO] Worker exiting (pid: 428)
airflow-webserver_1  | [2022-03-10 13:30:56 +0000] [427] [INFO] Worker exiting (pid: 427)
airflow-webserver_1  | [2022-03-10 13:30:58 +0000] [193] [CRITICAL] WORKER TIMEOUT (pid:430)
airflow-webserver_1  | [2022-03-10 13:30:58 +0000] [430] [INFO] Worker exiting (pid: 430)
airflow-webserver_1  | [2022-03-10 13:31:00 +0000] [193] [WARNING] Worker with pid 428 was terminated due to signal 9
airflow-webserver_1  | [2022-03-10 13:31:01 +0000] [480] [INFO] Booting worker with pid: 480
airflow-webserver_1  | [2022-03-10 13:31:01 +0000] [193] [WARNING] Worker with pid 430 was terminated due to signal 9
airflow-webserver_1  | [2022-03-10 13:31:01 +0000] [193] [WARNING] Worker with pid 427 was terminated due to signal 9
airflow-webserver_1  | [2022-03-10 13:31:01 +0000] [193] [WARNING] Worker with pid 429 was terminated due to signal 9
airflow-webserver_1  | [2022-03-10 13:31:01 +0000] [481] [INFO] Booting worker with pid: 481
airflow-webserver_1  | [2022-03-10 13:31:01 +0000] [482] [INFO] Booting worker with pid: 482
airflow-webserver_1  | [2022-03-10 13:31:01 +0000] [483] [INFO] Booting worker with pid: 483
airflow-webserver_1  | [2022-03-10 13:33:00 +0000] [193] [CRITICAL] WORKER TIMEOUT (pid:480)
airflow-webserver_1  | [2022-03-10 13:33:01 +0000] [480] [INFO] Worker exiting (pid: 480)
airflow-webserver_1  | [2022-03-10 13:33:02 +0000] [193] [CRITICAL] WORKER TIMEOUT (pid:481)
airflow-webserver_1  | [2022-03-10 13:33:02 +0000] [193] [CRITICAL] WORKER TIMEOUT (pid:482)
airflow-webserver_1  | [2022-03-10 13:33:02 +0000] [193] [CRITICAL] WORKER TIMEOUT (pid:483)
airflow-webserver_1  | [2022-03-10 13:33:02 +0000] [482] [INFO] Worker exiting (pid: 482)
airflow-webserver_1  | [2022-03-10 13:33:02 +0000] [481] [INFO] Worker exiting (pid: 481)
airflow-webserver_1  | [2022-03-10 13:33:03 +0000] [483] [INFO] Worker exiting (pid: 483)
airflow-webserver_1  | [2022-03-10 13:33:06 +0000] [193] [WARNING] Worker with pid 480 was terminated due to signal 9
airflow-webserver_1  | [2022-03-10 13:33:07 +0000] [193] [WARNING] Worker with pid 481 was terminated due to signal 9
airflow-webserver_1  | [2022-03-10 13:33:07 +0000] [193] [WARNING] Worker with pid 483 was terminated due to signal 9
airflow-webserver_1  | [2022-03-10 13:33:07 +0000] [544] [INFO] Booting worker with pid: 544
airflow-webserver_1  | [2022-03-10 13:33:07 +0000] [543] [INFO] Booting worker with pid: 543
airflow-webserver_1  | [2022-03-10 13:33:08 +0000] [545] [INFO] Booting worker with pid: 545
airflow-webserver_1  | [2022-03-10 13:33:08 +0000] [193] [WARNING] Worker with pid 482 was terminated due to signal 9
airflow-webserver_1  | [2022-03-10 13:33:08 +0000] [546] [INFO] Booting worker with pid: 546
airflow-webserver_1  | [2022-03-10 13:35:07 +0000] [193] [CRITICAL] WORKER TIMEOUT (pid:543)
airflow-webserver_1  | [2022-03-10 13:35:08 +0000] [193] [CRITICAL] WORKER TIMEOUT (pid:544)
airflow-webserver_1  | [2022-03-10 13:35:08 +0000] [193] [CRITICAL] WORKER TIMEOUT (pid:545)
airflow-webserver_1  | [2022-03-10 13:35:08 +0000] [544] [INFO] Worker exiting (pid: 544)
airflow-webserver_1  | [2022-03-10 13:35:08 +0000] [543] [INFO] Worker exiting (pid: 543)
airflow-webserver_1  | [2022-03-10 13:35:08 +0000] [545] [INFO] Worker exiting (pid: 545)
airflow-webserver_1  | [2022-03-10 13:35:09 +0000] [193] [CRITICAL] WORKER TIMEOUT (pid:546)
airflow-webserver_1  | [2022-03-10 13:35:12 +0000] [193] [WARNING] Worker with pid 546 was terminated due to signal 9
airflow-webserver_1  | [2022-03-10 13:35:13 +0000] [193] [WARNING] Worker with pid 545 was terminated due to signal 9
airflow-webserver_1  | [2022-03-10 13:35:13 +0000] [193] [WARNING] Worker with pid 544 was terminated due to signal 9
airflow-webserver_1  | [2022-03-10 13:35:13 +0000] [593] [INFO] Booting worker with pid: 593
airflow-webserver_1  | [2022-03-10 13:35:13 +0000] [193] [WARNING] Worker with pid 543 was terminated due to signal 9
airflow-webserver_1  | [2022-03-10 13:35:13 +0000] [595] [INFO] Booting worker with pid: 595
airflow-webserver_1  | [2022-03-10 13:35:14 +0000] [596] [INFO] Booting worker with pid: 596
airflow-webserver_1  | [2022-03-10 13:35:14 +0000] [597] [INFO] Booting worker with pid: 597
airflow-webserver_1  | [2022-03-10 13:37:14 +0000] [193] [CRITICAL] WORKER TIMEOUT (pid:593)
airflow-webserver_1  | [2022-03-10 13:37:14 +0000] [193] [CRITICAL] WORKER TIMEOUT (pid:595)
airflow-webserver_1  | [2022-03-10 13:37:14 +0000] [193] [CRITICAL] WORKER TIMEOUT (pid:596)
airflow-webserver_1  | [2022-03-10 13:37:14 +0000] [193] [CRITICAL] WORKER TIMEOUT (pid:597)
airflow-webserver_1  | [2022-03-10 13:37:15 +0000] [595] [INFO] Worker exiting (pid: 595)
airflow-webserver_1  | [2022-03-10 13:37:15 +0000] [597] [INFO] Worker exiting (pid: 597)
airflow-webserver_1  | [2022-03-10 13:37:15 +0000] [596] [INFO] Worker exiting (pid: 596)
airflow-webserver_1  | [2022-03-10 13:37:19 +0000] [193] [WARNING] Worker with pid 596 was terminated due to signal 9
airflow-webserver_1  | [2022-03-10 13:37:21 +0000] [193] [WARNING] Worker with pid 597 was terminated due to signal 9
airflow-webserver_1  | [2022-03-10 13:37:21 +0000] [193] [WARNING] Worker with pid 595 was terminated due to signal 9
airflow-webserver_1  | [2022-03-10 13:37:22 +0000] [647] [INFO] Booting worker with pid: 647
airflow-webserver_1  | [2022-03-10 13:37:22 +0000] [193] [WARNING] Worker with pid 593 was terminated due to signal 9
airflow-webserver_1  | [2022-03-10 13:37:22 +0000] [648] [INFO] Booting worker with pid: 648
airflow-webserver_1  | [2022-03-10 13:37:22 +0000] [649] [INFO] Booting worker with pid: 649
airflow-webserver_1  | [2022-03-10 13:37:23 +0000] [650] [INFO] Booting worker with pid: 650
airflow-webserver_1  | [2022-03-10 13:39:23 +0000] [193] [CRITICAL] WORKER TIMEOUT (pid:647)
airflow-webserver_1  | [2022-03-10 13:39:24 +0000] [193] [CRITICAL] WORKER TIMEOUT (pid:648)
airflow-webserver_1  | [2022-03-10 13:39:24 +0000] [193] [CRITICAL] WORKER TIMEOUT (pid:649)
airflow-webserver_1  | [2022-03-10 13:39:24 +0000] [193] [CRITICAL] WORKER TIMEOUT (pid:650)
airflow-webserver_1  | [2022-03-10 13:39:24 +0000] [647] [INFO] Worker exiting (pid: 647)
airflow-webserver_1  | [2022-03-10 13:39:24 +0000] [648] [INFO] Worker exiting (pid: 648)
airflow-webserver_1  | [2022-03-10 13:39:24 +0000] [650] [INFO] Worker exiting (pid: 650)
airflow-webserver_1  | [2022-03-10 13:39:24 +0000] [649] [INFO] Worker exiting (pid: 649)
airflow-webserver_1  | [2022-03-10 13:39:30 +0000] [193] [WARNING] Worker with pid 650 was terminated due to signal 9
airflow-webserver_1  | [2022-03-10 13:39:30 +0000] [193] [WARNING] Worker with pid 649 was terminated due to signal 9
airflow-webserver_1  | [2022-03-10 13:39:31 +0000] [711] [INFO] Booting worker with pid: 711
airflow-webserver_1  | [2022-03-10 13:39:31 +0000] [193] [WARNING] Worker with pid 648 was terminated due to signal 9
airflow-webserver_1  | [2022-03-10 13:39:31 +0000] [710] [INFO] Booting worker with pid: 710
airflow-webserver_1  | --- Logging error ---
airflow-webserver_1  | Traceback (most recent call last):
airflow-webserver_1  |   File "/usr/local/lib/python3.7/logging/__init__.py", line 1029, in emit
airflow-webserver_1  |     self.flush()
airflow-webserver_1  |   File "/usr/local/lib/python3.7/logging/__init__.py", line 1009, in flush
airflow-webserver_1  |     self.stream.flush()
airflow-webserver_1  | RuntimeError: reentrant call inside <_io.BufferedWriter name='<stderr>'>
airflow-webserver_1  | Call stack:
airflow-webserver_1  |   File "/usr/local/lib/python3.7/runpy.py", line 193, in _run_module_as_main
airflow-webserver_1  |     "__main__", mod_spec)
airflow-webserver_1  |   File "/usr/local/lib/python3.7/runpy.py", line 85, in _run_code
airflow-webserver_1  |     exec(code, run_globals)
airflow-webserver_1  |   File "/home/airflow/.local/lib/python3.7/site-packages/gunicorn/__main__.py", line 7, in <module>
airflow-webserver_1  |     run()
airflow-webserver_1  |   File "/home/airflow/.local/lib/python3.7/site-packages/gunicorn/app/wsgiapp.py", line 67, in run
airflow-webserver_1  |     WSGIApplication("%(prog)s [OPTIONS] [APP_MODULE]").run()
airflow-webserver_1  |   File "/home/airflow/.local/lib/python3.7/site-packages/gunicorn/app/base.py", line 231, in run
airflow-webserver_1  |     super().run()
airflow-webserver_1  |   File "/home/airflow/.local/lib/python3.7/site-packages/gunicorn/app/base.py", line 72, in run
airflow-webserver_1  |     Arbiter(self).run()
airflow-webserver_1  |   File "/home/airflow/.local/lib/python3.7/site-packages/gunicorn/arbiter.py", line 209, in run
airflow-webserver_1  |     self.sleep()
airflow-webserver_1  |   File "/home/airflow/.local/lib/python3.7/site-packages/gunicorn/arbiter.py", line 357, in sleep
airflow-webserver_1  |     ready = select.select([self.PIPE[0]], [], [], 1.0)
airflow-webserver_1  |   File "/home/airflow/.local/lib/python3.7/site-packages/gunicorn/arbiter.py", line 242, in handle_chld
airflow-webserver_1  |     self.reap_workers()
airflow-webserver_1  |   File "/home/airflow/.local/lib/python3.7/site-packages/gunicorn/arbiter.py", line 533, in reap_workers
airflow-webserver_1  |     os.WTERMSIG(status)
airflow-webserver_1  |   File "/home/airflow/.local/lib/python3.7/site-packages/gunicorn/glogging.py", line 261, in warning
airflow-webserver_1  |     self.error_log.warning(msg, *args, **kwargs)
airflow-webserver_1  |   File "/usr/local/lib/python3.7/logging/__init__.py", line 1390, in warning
airflow-webserver_1  |     self._log(WARNING, msg, args, **kwargs)
airflow-webserver_1  |   File "/usr/local/lib/python3.7/logging/__init__.py", line 1514, in _log
airflow-webserver_1  |     self.handle(record)
airflow-webserver_1  |   File "/usr/local/lib/python3.7/logging/__init__.py", line 1524, in handle
airflow-webserver_1  |     self.callHandlers(record)
airflow-webserver_1  |   File "/usr/local/lib/python3.7/logging/__init__.py", line 1586, in callHandlers
airflow-webserver_1  |     hdlr.handle(record)
airflow-webserver_1  |   File "/usr/local/lib/python3.7/logging/__init__.py", line 894, in handle
airflow-webserver_1  |     self.emit(record)
airflow-webserver_1  |   File "/usr/local/lib/python3.7/logging/__init__.py", line 1029, in emit
airflow-webserver_1  |     self.flush()
airflow-webserver_1  |   File "/usr/local/lib/python3.7/logging/__init__.py", line 1009, in flush
airflow-webserver_1  |     self.stream.flush()
airflow-webserver_1  |   File "/home/airflow/.local/lib/python3.7/site-packages/gunicorn/arbiter.py", line 242, in handle_chld
airflow-webserver_1  |     self.reap_workers()
airflow-webserver_1  |   File "/home/airflow/.local/lib/python3.7/site-packages/gunicorn/arbiter.py", line 533, in reap_workers
airflow-webserver_1  |     os.WTERMSIG(status)
airflow-webserver_1  |   File "/home/airflow/.local/lib/python3.7/site-packages/gunicorn/glogging.py", line 261, in warning
airflow-webserver_1  |     self.error_log.warning(msg, *args, **kwargs)
airflow-webserver_1  | Message: 'Worker with pid %s was terminated due to signal %s'
airflow-webserver_1  | Arguments: (647, 9)
airflow-webserver_1  | [2022-03-10 13:39:33 +0000] [713] [INFO] Booting worker with pid: 713
airflow-webserver_1  | --- Logging error ---
airflow-webserver_1  | Traceback (most recent call last):
airflow-webserver_1  |   File "/usr/local/lib/python3.7/logging/__init__.py", line 1029, in emit
airflow-webserver_1  |     self.flush()
airflow-webserver_1  |   File "/usr/local/lib/python3.7/logging/__init__.py", line 1009, in flush
airflow-webserver_1  |     self.stream.flush()
airflow-webserver_1  | RuntimeError: reentrant call inside <_io.BufferedWriter name='<stderr>'>
airflow-webserver_1  | Call stack:
airflow-webserver_1  |   File "/usr/local/lib/python3.7/runpy.py", line 193, in _run_module_as_main
airflow-webserver_1  |     "__main__", mod_spec)
airflow-webserver_1  |   File "/usr/local/lib/python3.7/runpy.py", line 85, in _run_code
airflow-webserver_1  |     exec(code, run_globals)
airflow-webserver_1  |   File "/home/airflow/.local/lib/python3.7/site-packages/gunicorn/__main__.py", line 7, in <module>
airflow-webserver_1  |     run()
airflow-webserver_1  |   File "/home/airflow/.local/lib/python3.7/site-packages/gunicorn/app/wsgiapp.py", line 67, in run
airflow-webserver_1  |     WSGIApplication("%(prog)s [OPTIONS] [APP_MODULE]").run()
airflow-webserver_1  |   File "/home/airflow/.local/lib/python3.7/site-packages/gunicorn/app/base.py", line 231, in run
airflow-webserver_1  |     super().run()
airflow-webserver_1  |   File "/home/airflow/.local/lib/python3.7/site-packages/gunicorn/app/base.py", line 72, in run
airflow-webserver_1  |     Arbiter(self).run()
airflow-webserver_1  |   File "/home/airflow/.local/lib/python3.7/site-packages/gunicorn/arbiter.py", line 209, in run
airflow-webserver_1  |     self.sleep()
airflow-webserver_1  |   File "/home/airflow/.local/lib/python3.7/site-packages/gunicorn/arbiter.py", line 357, in sleep
airflow-webserver_1  |     ready = select.select([self.PIPE[0]], [], [], 1.0)
airflow-webserver_1  |   File "/home/airflow/.local/lib/python3.7/site-packages/gunicorn/arbiter.py", line 242, in handle_chld
airflow-webserver_1  |     self.reap_workers()
airflow-webserver_1  |   File "/home/airflow/.local/lib/python3.7/site-packages/gunicorn/arbiter.py", line 533, in reap_workers
airflow-webserver_1  |     os.WTERMSIG(status)
airflow-webserver_1  |   File "/home/airflow/.local/lib/python3.7/site-packages/gunicorn/glogging.py", line 261, in warning
airflow-webserver_1  |     self.error_log.warning(msg, *args, **kwargs)
airflow-webserver_1  |   File "/usr/local/lib/python3.7/logging/__init__.py", line 1390, in warning
airflow-webserver_1  |     self._log(WARNING, msg, args, **kwargs)
airflow-webserver_1  |   File "/usr/local/lib/python3.7/logging/__init__.py", line 1514, in _log
airflow-webserver_1  |     self.handle(record)
airflow-webserver_1  |   File "/usr/local/lib/python3.7/logging/__init__.py", line 1524, in handle
airflow-webserver_1  |     self.callHandlers(record)
airflow-webserver_1  |   File "/usr/local/lib/python3.7/logging/__init__.py", line 1586, in callHandlers
airflow-webserver_1  |     hdlr.handle(record)
airflow-webserver_1  |   File "/usr/local/lib/python3.7/logging/__init__.py", line 894, in handle
airflow-webserver_1  |     self.emit(record)
airflow-webserver_1  |   File "/usr/local/lib/python3.7/logging/__init__.py", line 1029, in emit
airflow-webserver_1  |     self.flush()
airflow-webserver_1  |   File "/usr/local/lib/python3.7/logging/__init__.py", line 1009, in flush
airflow-webserver_1  |     self.stream.flush()
airflow-webserver_1  |   File "/home/airflow/.local/lib/python3.7/site-packages/gunicorn/arbiter.py", line 242, in handle_chld
airflow-webserver_1  |     self.reap_workers()
airflow-webserver_1  |   File "/home/airflow/.local/lib/python3.7/site-packages/gunicorn/arbiter.py", line 533, in reap_workers
airflow-webserver_1  |     os.WTERMSIG(status)
airflow-webserver_1  |   File "/home/airflow/.local/lib/python3.7/site-packages/gunicorn/glogging.py", line 261, in warning
airflow-webserver_1  |     self.error_log.warning(msg, *args, **kwargs)
airflow-webserver_1  | Message: 'Worker with pid %s was terminated due to signal %s'
airflow-webserver_1  | Arguments: (647, 9)
airflow-webserver_1  | [2022-03-10 13:39:34 +0000] [712] [INFO] Booting worker with pid: 712
airflow-webserver_1  | --- Logging error ---
airflow-webserver_1  | Traceback (most recent call last):
airflow-webserver_1  |   File "/usr/local/lib/python3.7/logging/__init__.py", line 1029, in emit
airflow-webserver_1  |     self.flush()
airflow-webserver_1  |   File "/usr/local/lib/python3.7/logging/__init__.py", line 1009, in flush
airflow-webserver_1  |     self.stream.flush()
airflow-webserver_1  | RuntimeError: reentrant call inside <_io.BufferedWriter name='<stderr>'>
airflow-webserver_1  | Call stack:
airflow-webserver_1  |   File "/usr/local/lib/python3.7/runpy.py", line 193, in _run_module_as_main
airflow-webserver_1  |     "__main__", mod_spec)
airflow-webserver_1  |   File "/usr/local/lib/python3.7/runpy.py", line 85, in _run_code
airflow-webserver_1  |     exec(code, run_globals)
airflow-webserver_1  |   File "/home/airflow/.local/lib/python3.7/site-packages/gunicorn/__main__.py", line 7, in <module>
airflow-webserver_1  |     run()
airflow-webserver_1  |   File "/home/airflow/.local/lib/python3.7/site-packages/gunicorn/app/wsgiapp.py", line 67, in run
airflow-webserver_1  |     WSGIApplication("%(prog)s [OPTIONS] [APP_MODULE]").run()
airflow-webserver_1  |   File "/home/airflow/.local/lib/python3.7/site-packages/gunicorn/app/base.py", line 231, in run
airflow-webserver_1  |     super().run()
airflow-webserver_1  |   File "/home/airflow/.local/lib/python3.7/site-packages/gunicorn/app/base.py", line 72, in run
airflow-webserver_1  |     Arbiter(self).run()
airflow-webserver_1  |   File "/home/airflow/.local/lib/python3.7/site-packages/gunicorn/arbiter.py", line 209, in run
airflow-webserver_1  |     self.sleep()
airflow-webserver_1  |   File "/home/airflow/.local/lib/python3.7/site-packages/gunicorn/arbiter.py", line 357, in sleep
airflow-webserver_1  |     ready = select.select([self.PIPE[0]], [], [], 1.0)
airflow-webserver_1  |   File "/home/airflow/.local/lib/python3.7/site-packages/gunicorn/arbiter.py", line 242, in handle_chld
airflow-webserver_1  |     self.reap_workers()
airflow-webserver_1  |   File "/home/airflow/.local/lib/python3.7/site-packages/gunicorn/arbiter.py", line 533, in reap_workers
airflow-webserver_1  |     os.WTERMSIG(status)
airflow-webserver_1  |   File "/home/airflow/.local/lib/python3.7/site-packages/gunicorn/glogging.py", line 261, in warning
airflow-webserver_1  |     self.error_log.warning(msg, *args, **kwargs)
airflow-webserver_1  |   File "/usr/local/lib/python3.7/logging/__init__.py", line 1390, in warning
airflow-webserver_1  |     self._log(WARNING, msg, args, **kwargs)
airflow-webserver_1  |   File "/usr/local/lib/python3.7/logging/__init__.py", line 1514, in _log
airflow-webserver_1  |     self.handle(record)
airflow-webserver_1  |   File "/usr/local/lib/python3.7/logging/__init__.py", line 1524, in handle
airflow-webserver_1  |     self.callHandlers(record)
airflow-webserver_1  |   File "/usr/local/lib/python3.7/logging/__init__.py", line 1586, in callHandlers
airflow-webserver_1  |     hdlr.handle(record)
airflow-webserver_1  |   File "/usr/local/lib/python3.7/logging/__init__.py", line 894, in handle
airflow-webserver_1  |     self.emit(record)
airflow-webserver_1  |   File "/usr/local/lib/python3.7/logging/__init__.py", line 1029, in emit
airflow-webserver_1  |     self.flush()
airflow-webserver_1  |   File "/usr/local/lib/python3.7/logging/__init__.py", line 1009, in flush
airflow-webserver_1  |     self.stream.flush()
airflow-webserver_1  |   File "/home/airflow/.local/lib/python3.7/site-packages/gunicorn/arbiter.py", line 242, in handle_chld
airflow-webserver_1  |     self.reap_workers()
airflow-webserver_1  |   File "/home/airflow/.local/lib/python3.7/site-packages/gunicorn/arbiter.py", line 533, in reap_workers
airflow-webserver_1  |     os.WTERMSIG(status)
airflow-webserver_1  |   File "/home/airflow/.local/lib/python3.7/site-packages/gunicorn/glogging.py", line 261, in warning
airflow-webserver_1  |     self.error_log.warning(msg, *args, **kwargs)
airflow-webserver_1  | Message: 'Worker with pid %s was terminated due to signal %s'
airflow-webserver_1  | Arguments: (647, 9)
airflow-webserver_1  | [2022-03-10 13:41:30 +0000] [193] [CRITICAL] WORKER TIMEOUT (pid:710)
airflow-webserver_1  | [2022-03-10 13:41:33 +0000] [193] [CRITICAL] WORKER TIMEOUT (pid:711)
airflow-webserver_1  | [2022-03-10 13:41:33 +0000] [193] [CRITICAL] WORKER TIMEOUT (pid:712)
airflow-webserver_1  | [2022-03-10 13:41:33 +0000] [193] [CRITICAL] WORKER TIMEOUT (pid:713)
airflow-webserver_1  | [2022-03-10 13:41:33 +0000] [710] [INFO] Worker exiting (pid: 710)
airflow-webserver_1  | [2022-03-10 13:41:33 +0000] [711] [INFO] Worker exiting (pid: 711)
airflow-webserver_1  | [2022-03-10 13:41:33 +0000] [713] [INFO] Worker exiting (pid: 713)
airflow-webserver_1  | [2022-03-10 13:41:33 +0000] [712] [INFO] Worker exiting (pid: 712)
airflow-webserver_1  | [2022-03-10 13:41:37 +0000] [193] [WARNING] Worker with pid 711 was terminated due to signal 9
airflow-webserver_1  | [2022-03-10 13:41:37 +0000] [193] [WARNING] Worker with pid 712 was terminated due to signal 9
airflow-webserver_1  | [2022-03-10 13:41:37 +0000] [193] [WARNING] Worker with pid 710 was terminated due to signal 9
airflow-webserver_1  | [2022-03-10 13:41:37 +0000] [193] [WARNING] Worker with pid 713 was terminated due to signal 9
airflow-webserver_1  | [2022-03-10 13:41:37 +0000] [764] [INFO] Booting worker with pid: 764
airflow-webserver_1  | [2022-03-10 13:41:37 +0000] [765] [INFO] Booting worker with pid: 765
airflow-webserver_1  | [2022-03-10 13:41:38 +0000] [766] [INFO] Booting worker with pid: 766
airflow-webserver_1  | [2022-03-10 13:41:38 +0000] [767] [INFO] Booting worker with pid: 767
```

![Screenshot 2022-03-10 at 16 37 12](https://user-images.githubusercontent.com/77328631/157673002-723ea721-c05a-408d-a7b3-039d830c41d4.jpg)

Not really sure what the problem is. When trying to connect to the webserver it does not work.

### How to solve the problem

Is it related to my machine ? It's a macbook air from 2015... I though it would be enough.
Is there another way to run airflow and try to run dags ?

### Anything else

Every Time.

### Are you willing to submit PR?

- [X] Yes I am willing to submit a PR!

### Code of Conduct

- [X] I agree to follow this project's [Code of Conduct](https://github.com/apache/airflow/blob/main/CODE_OF_CONDUCT.md)

**Comment by boring-cyborg** [comment]
Thanks for opening your first issue here! Be sure to follow the issue template!

**Reply by potiuk** [reply]
You likely have a hardware problem with your MacBook. Try a different machine.

**Comment by hickey** [comment]
I have a similar problem where the scheduler can not connect to the webserver. 

I am running v2.3.3 in Docker containers. I have the webserver coming up correctly and can connect to the webserver just fine. The webserver runs behind a Traefik proxy. 

When I bring up the scheduler I get the following output:

```
airflow-scheduler 08:32:36.87
airflow-scheduler 08:32:36.88 Welcome to the Bitnami airflow-scheduler container
airflow-scheduler 08:32:36.88 Subscribe to project updates by watching https://github.com/bitnami/containers
airflow-scheduler 08:32:36.89 Submit issues and feature requests at https://github.com/bitnami/containers/issues
airflow-scheduler 08:32:36.89
airflow-scheduler 08:32:36.90 INFO  ==> Enabling non-root system user with nss_wrapper
airflow-scheduler 08:32:36.92 INFO  ==> ** Starting Airflow setup **
airflow-scheduler 08:32:37.00 INFO  ==> Configuration file found, loading configuration
airflow-scheduler 08:32:37.00 INFO  ==> Trying to connect to the database server
airflow-scheduler 08:32:39.33 INFO  ==> Waiting for Airflow Webserser to be up
timeout reached before the port went into state "inuse"
timeout reached before the port went into state "inuse"
timeout reached before the port went into state "inuse"
timeout reached before the port went into state "inuse"
timeout reached before the port went into state "inuse"
timeout reached before the port went into state "inuse"
timeout reached before the port went into state "inuse"
timeout reached before the port went into state "inuse"
timeout reached before the port went into state "inuse"
timeout reached before the port went into state "inuse"
timeout reached before the port went into state "inuse"
timeout reached before the port went into state "inuse"
```

Two notes about the above. 

1. I have set the `logging_level` to `DEBUG`, but scheduler does not seem to actually set the logging level correctly. I have not been ever able to get the scheduler to output debugging information.
2. It would really be useful to output something more useful than the above timeout message. BTW the same message is used when the database port is not able to be contacted. 

I installed `tcpdump` in the scheduler container to be able to see the where the connections were trying to go. 

```
08:33:50.375393 IP ed0e590d0ccb.46999 > dns.google.domain: 20042+ A? airflow.wt0f.com. (34)
08:33:50.375503 IP ed0e590d0ccb.52935 > dns.google.domain: 15903+ AAAA? airflow.wt0f.com. (34)
08:33:50.376519 IP dns.google.domain > ed0e590d0ccb.46999: 20042 2/0/0 CNAME risa.wt0f.com., A 63.250.55.206 (69)
08:33:50.383283 IP dns.google.domain > ed0e590d0ccb.52935: 15903 1/1/0 CNAME risa.wt0f.com. (111)
08:33:50.383770 IP ed0e590d0ccb.41470 > 63.250.55.206.http-alt: Flags [S], seq 1771265012, win 64240, options [mss 1460,sackOK,TS val 694074074 ecr 0,nop,wscale 7], length 0
08:33:50.383810 IP 63.250.55.206.http-alt > ed0e590d0ccb.41470: Flags [R.], seq 0, ack 1771265013, win 0, length 0
```

The above packets continually get transmitted until the container exits out. 

Now the only reference to airflow.wt0f.com in is in the `base_url` setting. Even if I change this setting to 'http://airflow'--which is resolvable given the containers run on a separate Docker network--the server is still trying to connect to the FQDN. How it is getting this FQDN is beyond me. (Update: just figured out this part. I had `AIRFLOW_WEBSERVER_HOST` defined to the FQDN)

The real problem I have been having is that scheduler is trying to connect to the webserver on port 8080. This port is not exposed because of the Traefik proxy. The webserver is only exposed on port 443. I am not able to find a configuration setting that will allow me to instruct the scheduler to connect on a specified port. Given the update I have above, I have tried setting `AIRFLOW_WEBSERVER_PORT`, but that does not seem to have any effect. 

I seem to be having the same problem with the worker. So running a single worker can be made to work if the worker is on the same host and connected to the same Docker network. But if I run a worker on another host I am going to run in to the same problem again if the port can not be specified. 

Is there a way to specify what port the webserver is running on? Also given that I run it on port 443, how do I tell scheduler and worker to use TLS?

**Reply by potiuk** [reply]
Those are great questions that should be asked in Bitnami repository. The community here has no access/control/knowledge about the bitnami charts. We have no influence, knowlege what they do and how.  It's even written in the output you got:

```
airflow-scheduler 08:32:36.88 Subscribe to project updates by watching https://github.com/bitnami/containers
airflow-scheduler 08:32:36.89 Submit issues and feature requests at https://github.com/bitnami/containers/issues
```

We will be more than happy to answer similar questions if you use the Airflow Community official image https://airflow.apache.org/docs/docker-stack/index.html and Airflow Official Helm Chart - https://airflow.apache.org/docs/helm-chart/stable/index.html but when you have problem which looks like deployment related and you use bitnami containers and chart - you should check with them :)

**Reply by quocanh-upmesh** [reply]
Hi @hickey, I was in the same situation as you, in my case, I deployed airflow to k8s and in `airflow-scheduler` pod, 2 webserver env variables `AIRFLOW_WEBSERVER_HOST` == `airflow` and `AIRFLOW_WEBSERVER_PORT_NUMBER` == `8080` then a`irflow-scheduler` restarted continuously and it got the same log as you while `airflow-webserver` was still work:
```
airflow-scheduler 02:38:03.02 INFO  ==> Waiting for Airflow Webserver to be up
timeout reached before the port went into state "inuse"
```
Then I did a weird implementation, it worked fine again and was able to connect to `http://airflow:8080` from `airflow-scheduler`. Do you know if you have found the root cause or fixed this error?

**Reply by v-ra-ins** [reply]
@quocanh-upmesh  what did you do to fix it? i am facing same issue
