### ISSUE TITLE
Airflow web UI is slow

### ISSUE THREAD

**Issue by sylr** [apache/airflow#8907]
**Apache Airflow version**:

1.10.10

**Kubernetes version (if you are using kubernetes)** (use `kubectl version`):

1.13.12

**Environment**:

- **Cloud provider or hardware configuration**: Azure
- **OS** (e.g. from /etc/os-release):
- **Kernel** (e.g. `uname -a`):
- **Install tools**:
- **Others**:

**What happened**:

Every HTTP requests of the UI takes at least 5s, even static content.

<img width="1678" alt="Airflow_-_DAGs" src="https://user-images.githubusercontent.com/153052/82304675-e9955200-99bc-11ea-9ecf-012c0b9fa283.png">

`/admin/metrics/`, `/health` endpoints and 404 page have the same problems.

Here a graphs showing CPU usage of all ariflow components:

<img width="1661" alt="k8s-pods-2-thanos_-_Grafana" src="https://user-images.githubusercontent.com/153052/82306296-295d3900-99bf-11ea-80af-65be58907042.png">

Each container has a 1s limit (left Y axis) so none of them is currently CPU bound. 

**What you expected to happen**:

**How to reproduce it**:

**Anything else we need to know**:

**Comment by sylr** [comment]
The graphs shows the queries going through a reverse proxy but I've also tried directly with a `kubectl port-forward` and the problem persists.

**Comment by ashb** [comment]
@sylr A flat 5s latency sounds odd, and isn't something Airflow itself is doing, so there's something environmental going on here.

Things to check: if you run it locally, do you see this?

Is there anything of note in the webserver logs?

**Comment by sylr** [comment]
I don't see anything suspicious is the logs.

But know that I think of it, 5s latency looks very much like a DNS timeout.

Any chance each request might trigger a DNS resolve ?

**Comment by sylr** [comment]
After tcpdump'ing the calico interface of the pod I see DNS storms happening regularly:

<details>
<p>

```
09:28:59.015823 IP 10.100.200.247.48834 > 10.200.0.10.53: 5541+ A? pgbouncer-airflow-euw-dev-db.pgbouncer.svc.cluster.local. (74)
09:28:59.015945 IP 10.100.200.247.48834 > 10.200.0.10.53: 31584+ AAAA? pgbouncer-airflow-euw-dev-db.pgbouncer.svc.cluster.local. (74)
09:28:59.018028 IP 10.200.0.10.53 > 10.100.200.247.48834: 31584 0/1/0 (167)
09:28:59.018047 IP 10.200.0.10.53 > 10.100.200.247.48834: 5541 1/0/0 A 10.200.200.112 (146)
09:28:59.119883 IP 10.100.200.247.47755 > 10.200.0.10.53: 13679+ A? pgbouncer-airflow-euw-dev-db.pgbouncer.svc.cluster.local. (74)
09:28:59.119946 IP 10.100.200.247.47755 > 10.200.0.10.53: 43156+ AAAA? pgbouncer-airflow-euw-dev-db.pgbouncer.svc.cluster.local. (74)
09:28:59.122361 IP 10.200.0.10.53 > 10.100.200.247.47755: 43156 0/1/0 (167)
09:28:59.122371 IP 10.200.0.10.53 > 10.100.200.247.47755: 13679 1/0/0 A 10.200.200.112 (146)
09:28:59.152829 IP 10.100.200.247.58370 > 10.200.0.10.53: 58782+ A? pgbouncer-airflow-euw-dev-db.pgbouncer.svc.cluster.local. (74)
09:28:59.152880 IP 10.100.200.247.58370 > 10.200.0.10.53: 7090+ AAAA? pgbouncer-airflow-euw-dev-db.pgbouncer.svc.cluster.local. (74)
09:28:59.154867 IP 10.200.0.10.53 > 10.100.200.247.58370: 7090 0/1/0 (167)
09:28:59.154891 IP 10.200.0.10.53 > 10.100.200.247.58370: 58782 1/0/0 A 10.200.200.112 (146)
09:28:59.184799 IP 10.100.200.247.58574 > 10.200.0.10.53: 57115+ A? pgbouncer-airflow-euw-dev-db.pgbouncer.svc.cluster.local. (74)
09:28:59.184851 IP 10.100.200.247.58574 > 10.200.0.10.53: 60045+ AAAA? pgbouncer-airflow-euw-dev-db.pgbouncer.svc.cluster.local. (74)
09:28:59.186847 IP 10.200.0.10.53 > 10.100.200.247.58574: 60045 0/1/0 (167)
09:28:59.186856 IP 10.200.0.10.53 > 10.100.200.247.58574: 57115 1/0/0 A 10.200.200.112 (146)
09:28:59.215413 IP 10.100.200.247.40955 > 10.200.0.10.53: 26105+ A? pgbouncer-airflow-euw-dev-db.pgbouncer.svc.cluster.local. (74)
09:28:59.215478 IP 10.100.200.247.40955 > 10.200.0.10.53: 44651+ AAAA? pgbouncer-airflow-euw-dev-db.pgbouncer.svc.cluster.local. (74)
09:28:59.217466 IP 10.200.0.10.53 > 10.100.200.247.40955: 44651 0/1/0 (167)
09:28:59.217482 IP 10.200.0.10.53 > 10.100.200.247.40955: 26105 1/0/0 A 10.200.200.112 (146)
09:28:59.250327 IP 10.100.200.247.50636 > 10.200.0.10.53: 61779+ A? pgbouncer-airflow-euw-dev-db.pgbouncer.svc.cluster.local. (74)
09:28:59.250373 IP 10.100.200.247.50636 > 10.200.0.10.53: 48450+ AAAA? pgbouncer-airflow-euw-dev-db.pgbouncer.svc.cluster.local. (74)
09:28:59.252427 IP 10.200.0.10.53 > 10.100.200.247.50636: 48450 0/1/0 (167)
09:28:59.252438 IP 10.200.0.10.53 > 10.100.200.247.50636: 61779 1/0/0 A 10.200.200.112 (146)
09:28:59.288157 IP 10.100.200.247.41354 > 10.200.0.10.53: 14534+ A? pgbouncer-airflow-euw-dev-db.pgbouncer.svc.cluster.local. (74)
09:28:59.288241 IP 10.100.200.247.41354 > 10.200.0.10.53: 5456+ AAAA? pgbouncer-airflow-euw-dev-db.pgbouncer.svc.cluster.local. (74)
09:28:59.290238 IP 10.200.0.10.53 > 10.100.200.247.41354: 5456 0/1/0 (167)
09:28:59.290255 IP 10.200.0.10.53 > 10.100.200.247.41354: 14534 1/0/0 A 10.200.200.112 (146)
09:28:59.316804 IP 10.100.200.247.37139 > 10.200.0.10.53: 8652+ A? pgbouncer-airflow-euw-dev-db.pgbouncer.svc.cluster.local. (74)
09:28:59.316857 IP 10.100.200.247.37139 > 10.200.0.10.53: 6224+ AAAA? pgbouncer-airflow-euw-dev-db.pgbouncer.svc.cluster.local. (74)
09:28:59.319133 IP 10.200.0.10.53 > 10.100.200.247.37139: 6224 0/1/0 (167)
09:28:59.319146 IP 10.200.0.10.53 > 10.100.200.247.37139: 8652 1/0/0 A 10.200.200.112 (146)
09:28:59.349430 IP 10.100.200.247.37475 > 10.200.0.10.53: 37175+ A? pgbouncer-airflow-euw-dev-db.pgbouncer.svc.cluster.local. (74)
09:28:59.349493 IP 10.100.200.247.37475 > 10.200.0.10.53: 14629+ AAAA? pgbouncer-airflow-euw-dev-db.pgbouncer.svc.cluster.local. (74)
09:28:59.353289 IP 10.200.0.10.53 > 10.100.200.247.37475: 14629 0/1/0 (167)
09:28:59.353297 IP 10.200.0.10.53 > 10.100.200.247.37475: 37175 1/0/0 A 10.200.200.112 (146)
09:28:59.380938 IP 10.100.200.247.48920 > 10.200.0.10.53: 1156+ A? pgbouncer-airflow-euw-dev-db.pgbouncer.svc.cluster.local. (74)
09:28:59.380997 IP 10.100.200.247.48920 > 10.200.0.10.53: 44267+ AAAA? pgbouncer-airflow-euw-dev-db.pgbouncer.svc.cluster.local. (74)
09:28:59.382860 IP 10.200.0.10.53 > 10.100.200.247.48920: 44267 0/1/0 (167)
09:28:59.382876 IP 10.200.0.10.53 > 10.100.200.247.48920: 1156 1/0/0 A 10.200.200.112 (146)
09:28:59.410210 IP 10.100.200.247.45481 > 10.200.0.10.53: 53239+ A? pgbouncer-airflow-euw-dev-db.pgbouncer.svc.cluster.local. (74)
09:28:59.410307 IP 10.100.200.247.45481 > 10.200.0.10.53: 26379+ AAAA? pgbouncer-airflow-euw-dev-db.pgbouncer.svc.cluster.local. (74)
09:28:59.412452 IP 10.200.0.10.53 > 10.100.200.247.45481: 26379 0/1/0 (167)
09:28:59.412469 IP 10.200.0.10.53 > 10.100.200.247.45481: 53239 1/0/0 A 10.200.200.112 (146)
09:28:59.446560 IP 10.100.200.247.49295 > 10.200.0.10.53: 59081+ A? pgbouncer-airflow-euw-dev-db.pgbouncer.svc.cluster.local. (74)
09:28:59.446656 IP 10.100.200.247.49295 > 10.200.0.10.53: 54161+ AAAA? pgbouncer-airflow-euw-dev-db.pgbouncer.svc.cluster.local. (74)
09:28:59.448377 IP 10.200.0.10.53 > 10.100.200.247.49295: 54161 0/1/0 (167)
09:28:59.448389 IP 10.200.0.10.53 > 10.100.200.247.49295: 59081 1/0/0 A 10.200.200.112 (146)
09:28:59.475288 IP 10.100.200.247.47422 > 10.200.0.10.53: 36520+ A? pgbouncer-airflow-euw-dev-db.pgbouncer.svc.cluster.local. (74)
09:28:59.475343 IP 10.100.200.247.47422 > 10.200.0.10.53: 54726+ AAAA? pgbouncer-airflow-euw-dev-db.pgbouncer.svc.cluster.local. (74)
09:28:59.477281 IP 10.200.0.10.53 > 10.100.200.247.47422: 54726 0/1/0 (167)
09:28:59.477289 IP 10.200.0.10.53 > 10.100.200.247.47422: 36520 1/0/0 A 10.200.200.112 (146)
09:28:59.521546 IP 10.100.200.247.60032 > 10.200.0.10.53: 757+ A? pgbouncer-airflow-euw-dev-db.pgbouncer.svc.cluster.local. (74)
09:28:59.521769 IP 10.100.200.247.60032 > 10.200.0.10.53: 62768+ AAAA? pgbouncer-airflow-euw-dev-db.pgbouncer.svc.cluster.local. (74)
09:28:59.523734 IP 10.200.0.10.53 > 10.100.200.247.60032: 62768 0/1/0 (167)
09:28:59.523756 IP 10.200.0.10.53 > 10.100.200.247.60032: 757 1/0/0 A 10.200.200.112 (146)
09:28:59.553836 IP 10.100.200.247.41101 > 10.200.0.10.53: 14844+ A? pgbouncer-airflow-euw-dev-db.pgbouncer.svc.cluster.local. (74)
09:28:59.554091 IP 10.100.200.247.41101 > 10.200.0.10.53: 49362+ AAAA? pgbouncer-airflow-euw-dev-db.pgbouncer.svc.cluster.local. (74)
09:28:59.555907 IP 10.200.0.10.53 > 10.100.200.247.41101: 49362 0/1/0 (167)
09:28:59.555924 IP 10.200.0.10.53 > 10.100.200.247.41101: 14844 1/0/0 A 10.200.200.112 (146)
09:28:59.583446 IP 10.100.200.247.53780 > 10.200.0.10.53: 23152+ A? pgbouncer-airflow-euw-dev-db.pgbouncer.svc.cluster.local. (74)
09:28:59.583495 IP 10.100.200.247.53780 > 10.200.0.10.53: 25366+ AAAA? pgbouncer-airflow-euw-dev-db.pgbouncer.svc.cluster.local. (74)
09:28:59.585769 IP 10.200.0.10.53 > 10.100.200.247.53780: 25366 0/1/0 (167)
09:28:59.585778 IP 10.200.0.10.53 > 10.100.200.247.53780: 23152 1/0/0 A 10.200.200.112 (146)
09:28:59.621638 IP 10.100.200.247.60679 > 10.200.0.10.53: 31974+ A? pgbouncer-airflow-euw-dev-db.pgbouncer.svc.cluster.local. (74)
09:28:59.621776 IP 10.100.200.247.60679 > 10.200.0.10.53: 23231+ AAAA? pgbouncer-airflow-euw-dev-db.pgbouncer.svc.cluster.local. (74)
09:28:59.623964 IP 10.200.0.10.53 > 10.100.200.247.60679: 23231 0/1/0 (167)
09:28:59.623986 IP 10.200.0.10.53 > 10.100.200.247.60679: 31974 1/0/0 A 10.200.200.112 (146)
09:28:59.651001 IP 10.100.200.247.57007 > 10.200.0.10.53: 57821+ A? pgbouncer-airflow-euw-dev-db.pgbouncer.svc.cluster.local. (74)
09:28:59.651071 IP 10.100.200.247.57007 > 10.200.0.10.53: 31235+ AAAA? pgbouncer-airflow-euw-dev-db.pgbouncer.svc.cluster.local. (74)
09:28:59.653094 IP 10.200.0.10.53 > 10.100.200.247.57007: 31235 0/1/0 (167)
09:28:59.653109 IP 10.200.0.10.53 > 10.100.200.247.57007: 57821 1/0/0 A 10.200.200.112 (146)
09:28:59.681058 IP 10.100.200.247.45515 > 10.200.0.10.53: 45959+ A? pgbouncer-airflow-euw-dev-db.pgbouncer.svc.cluster.local. (74)
09:28:59.681110 IP 10.100.200.247.45515 > 10.200.0.10.53: 55314+ AAAA? pgbouncer-airflow-euw-dev-db.pgbouncer.svc.cluster.local. (74)
09:28:59.683057 IP 10.200.0.10.53 > 10.100.200.247.45515: 55314 0/1/0 (167)
09:28:59.683065 IP 10.200.0.10.53 > 10.100.200.247.45515: 45959 1/0/0 A 10.200.200.112 (146)
09:28:59.710461 IP 10.100.200.247.50842 > 10.200.0.10.53: 51961+ A? pgbouncer-airflow-euw-dev-db.pgbouncer.svc.cluster.local. (74)
09:28:59.710531 IP 10.100.200.247.50842 > 10.200.0.10.53: 34025+ AAAA? pgbouncer-airflow-euw-dev-db.pgbouncer.svc.cluster.local. (74)
09:28:59.712553 IP 10.200.0.10.53 > 10.100.200.247.50842: 51961 1/0/0 A 10.200.200.112 (146)
09:28:59.712562 IP 10.200.0.10.53 > 10.100.200.247.50842: 34025 0/1/0 (167)
09:28:59.740255 IP 10.100.200.247.55841 > 10.200.0.10.53: 61366+ A? pgbouncer-airflow-euw-dev-db.pgbouncer.svc.cluster.local. (74)
09:28:59.740316 IP 10.100.200.247.55841 > 10.200.0.10.53: 29839+ AAAA? pgbouncer-airflow-euw-dev-db.pgbouncer.svc.cluster.local. (74)
09:28:59.742652 IP 10.200.0.10.53 > 10.100.200.247.55841: 29839 0/1/0 (167)
09:28:59.742699 IP 10.200.0.10.53 > 10.100.200.247.55841: 61366 1/0/0 A 10.200.200.112 (146)
09:28:59.776247 IP 10.100.200.247.41085 > 10.200.0.10.53: 47734+ A? pgbouncer-airflow-euw-dev-db.pgbouncer.svc.cluster.local. (74)
09:28:59.776315 IP 10.100.200.247.41085 > 10.200.0.10.53: 63337+ AAAA? pgbouncer-airflow-euw-dev-db.pgbouncer.svc.cluster.local. (74)
09:28:59.778304 IP 10.200.0.10.53 > 10.100.200.247.41085: 63337 0/1/0 (167)
09:28:59.778317 IP 10.200.0.10.53 > 10.100.200.247.41085: 47734 1/0/0 A 10.200.200.112 (146)
09:28:59.807908 IP 10.100.200.247.49690 > 10.200.0.10.53: 44830+ A? pgbouncer-airflow-euw-dev-db.pgbouncer.svc.cluster.local. (74)
09:28:59.807988 IP 10.100.200.247.49690 > 10.200.0.10.53: 4065+ AAAA? pgbouncer-airflow-euw-dev-db.pgbouncer.svc.cluster.local. (74)
09:28:59.810075 IP 10.200.0.10.53 > 10.100.200.247.49690: 4065 0/1/0 (167)
09:28:59.810095 IP 10.200.0.10.53 > 10.100.200.247.49690: 44830 1/0/0 A 10.200.200.112 (146)
09:28:59.843925 IP 10.100.200.247.33388 > 10.200.0.10.53: 24247+ A? pgbouncer-airflow-euw-dev-db.pgbouncer.svc.cluster.local. (74)
09:28:59.843999 IP 10.100.200.247.33388 > 10.200.0.10.53: 20892+ AAAA? pgbouncer-airflow-euw-dev-db.pgbouncer.svc.cluster.local. (74)
09:28:59.846250 IP 10.200.0.10.53 > 10.100.200.247.33388: 20892 0/1/0 (167)
09:28:59.846258 IP 10.200.0.10.53 > 10.100.200.247.33388: 24247 1/0/0 A 10.200.200.112 (146)
09:28:59.875208 IP 10.100.200.247.35029 > 10.200.0.10.53: 22272+ A? pgbouncer-airflow-euw-dev-db.pgbouncer.svc.cluster.local. (74)
09:28:59.875292 IP 10.100.200.247.35029 > 10.200.0.10.53: 44911+ AAAA? pgbouncer-airflow-euw-dev-db.pgbouncer.svc.cluster.local. (74)
09:28:59.877363 IP 10.200.0.10.53 > 10.100.200.247.35029: 44911 0/1/0 (167)
09:28:59.877386 IP 10.200.0.10.53 > 10.100.200.247.35029: 22272 1/0/0 A 10.200.200.112 (146)
09:28:59.907032 IP 10.100.200.247.57515 > 10.200.0.10.53: 32052+ A? pgbouncer-airflow-euw-dev-db.pgbouncer.svc.cluster.local. (74)
09:28:59.907081 IP 10.100.200.247.57515 > 10.200.0.10.53: 52480+ AAAA? pgbouncer-airflow-euw-dev-db.pgbouncer.svc.cluster.local. (74)
09:28:59.909377 IP 10.200.0.10.53 > 10.100.200.247.57515: 32052 1/0/0 A 10.200.200.112 (146)
09:28:59.909408 IP 10.200.0.10.53 > 10.100.200.247.57515: 52480 0/1/0 (167)
09:28:59.938166 IP 10.100.200.247.59087 > 10.200.0.10.53: 34515+ A? pgbouncer-airflow-euw-dev-db.pgbouncer.svc.cluster.local. (74)
09:28:59.938216 IP 10.100.200.247.59087 > 10.200.0.10.53: 34221+ AAAA? pgbouncer-airflow-euw-dev-db.pgbouncer.svc.cluster.local. (74)
09:28:59.940322 IP 10.200.0.10.53 > 10.100.200.247.59087: 34221 0/1/0 (167)
09:28:59.940322 IP 10.200.0.10.53 > 10.100.200.247.59087: 34515 1/0/0 A 10.200.200.112 (146)
09:28:59.971500 IP 10.100.200.247.38746 > 10.200.0.10.53: 30233+ A? pgbouncer-airflow-euw-dev-db.pgbouncer.svc.cluster.local. (74)
09:28:59.971549 IP 10.100.200.247.38746 > 10.200.0.10.53: 50574+ AAAA? pgbouncer-airflow-euw-dev-db.pgbouncer.svc.cluster.local. (74)
09:28:59.973507 IP 10.200.0.10.53 > 10.100.200.247.38746: 50574 0/1/0 (167)
09:28:59.973525 IP 10.200.0.10.53 > 10.100.200.247.38746: 30233 1/0/0 A 10.200.200.112 (146)
09:29:00.003333 IP 10.100.200.247.33638 > 10.200.0.10.53: 28482+ A? pgbouncer-airflow-euw-dev-db.pgbouncer.svc.cluster.local. (74)
09:29:00.003381 IP 10.100.200.247.33638 > 10.200.0.10.53: 45054+ AAAA? pgbouncer-airflow-euw-dev-db.pgbouncer.svc.cluster.local. (74)
09:29:00.006434 IP 10.200.0.10.53 > 10.100.200.247.33638: 28482 1/0/0 A 10.200.200.112 (146)
09:29:00.006444 IP 10.200.0.10.53 > 10.100.200.247.33638: 45054 0/1/0 (167)
09:29:00.040531 IP 10.100.200.247.34705 > 10.200.0.10.53: 5107+ A? pgbouncer-airflow-euw-dev-db.pgbouncer.svc.cluster.local. (74)
09:29:00.040588 IP 10.100.200.247.34705 > 10.200.0.10.53: 43505+ AAAA? pgbouncer-airflow-euw-dev-db.pgbouncer.svc.cluster.local. (74)
09:29:00.042404 IP 10.200.0.10.53 > 10.100.200.247.34705: 5107 1/0/0 A 10.200.200.112 (146)
09:29:00.042404 IP 10.200.0.10.53 > 10.100.200.247.34705: 43505 0/1/0 (167)
09:29:00.075100 IP 10.100.200.247.55294 > 10.200.0.10.53: 45392+ A? pgbouncer-airflow-euw-dev-db.pgbouncer.svc.cluster.local. (74)
09:29:00.075173 IP 10.100.200.247.55294 > 10.200.0.10.53: 701+ AAAA? pgbouncer-airflow-euw-dev-db.pgbouncer.svc.cluster.local. (74)
09:29:00.077179 IP 10.200.0.10.53 > 10.100.200.247.55294: 701 0/1/0 (167)
09:29:00.077227 IP 10.200.0.10.53 > 10.100.200.247.55294: 45392 1/0/0 A 10.200.200.112 (146)
09:29:00.106407 IP 10.100.200.247.41436 > 10.200.0.10.53: 12032+ A? pgbouncer-airflow-euw-dev-db.pgbouncer.svc.cluster.local. (74)
09:29:00.106490 IP 10.100.200.247.41436 > 10.200.0.10.53: 5708+ AAAA? pgbouncer-airflow-euw-dev-db.pgbouncer.svc.cluster.local. (74)
09:29:00.108370 IP 10.200.0.10.53 > 10.100.200.247.41436: 12032 1/0/0 A 10.200.200.112 (146)
09:29:00.108423 IP 10.200.0.10.53 > 10.100.200.247.41436: 5708 0/1/0 (167)
09:29:00.143047 IP 10.100.200.247.52164 > 10.200.0.10.53: 27092+ A? pgbouncer-airflow-euw-dev-db.pgbouncer.svc.cluster.local. (74)
09:29:00.143091 IP 10.100.200.247.52164 > 10.200.0.10.53: 55910+ AAAA? pgbouncer-airflow-euw-dev-db.pgbouncer.svc.cluster.local. (74)
09:29:00.144905 IP 10.200.0.10.53 > 10.100.200.247.52164: 27092 1/0/0 A 10.200.200.112 (146)
09:29:00.144922 IP 10.200.0.10.53 > 10.100.200.247.52164: 55910 0/1/0 (167)
09:29:00.172770 IP 10.100.200.247.33538 > 10.200.0.10.53: 27790+ A? pgbouncer-airflow-euw-dev-db.pgbouncer.svc.cluster.local. (74)
09:29:00.172824 IP 10.100.200.247.33538 > 10.200.0.10.53: 19390+ AAAA? pgbouncer-airflow-euw-dev-db.pgbouncer.svc.cluster.local. (74)
09:29:00.174834 IP 10.200.0.10.53 > 10.100.200.247.33538: 19390 0/1/0 (167)
09:29:00.174855 IP 10.200.0.10.53 > 10.100.200.247.33538: 27790 1/0/0 A 10.200.200.112 (146)
09:29:00.203851 IP 10.100.200.247.59638 > 10.200.0.10.53: 26896+ A? pgbouncer-airflow-euw-dev-db.pgbouncer.svc.cluster.local. (74)
09:29:00.203928 IP 10.100.200.247.59638 > 10.200.0.10.53: 36464+ AAAA? pgbouncer-airflow-euw-dev-db.pgbouncer.svc.cluster.local. (74)
09:29:00.206213 IP 10.200.0.10.53 > 10.100.200.247.59638: 36464 0/1/0 (167)
09:29:00.206228 IP 10.200.0.10.53 > 10.100.200.247.59638: 26896 1/0/0 A 10.200.200.112 (146)
09:29:00.234776 IP 10.100.200.247.59072 > 10.200.0.10.53: 44429+ A? pgbouncer-airflow-euw-dev-db.pgbouncer.svc.cluster.local. (74)
09:29:00.234846 IP 10.100.200.247.59072 > 10.200.0.10.53: 54455+ AAAA? pgbouncer-airflow-euw-dev-db.pgbouncer.svc.cluster.local. (74)
09:29:00.236665 IP 10.200.0.10.53 > 10.100.200.247.59072: 54455 0/1/0 (167)
09:29:00.236683 IP 10.200.0.10.53 > 10.100.200.247.59072: 44429 1/0/0 A 10.200.200.112 (146)
09:29:00.286326 IP 10.100.200.247.53482 > 10.200.0.10.53: 17364+ A? pgbouncer-airflow-euw-dev-db.pgbouncer.svc.cluster.local. (74)
09:29:00.286398 IP 10.100.200.247.53482 > 10.200.0.10.53: 43775+ AAAA? pgbouncer-airflow-euw-dev-db.pgbouncer.svc.cluster.local. (74)
09:29:00.288412 IP 10.200.0.10.53 > 10.100.200.247.53482: 43775 0/1/0 (167)
09:29:00.289827 IP 10.200.0.10.53 > 10.100.200.247.53482: 17364 1/0/0 A 10.200.200.112 (146)
09:29:00.319409 IP 10.100.200.247.57044 > 10.200.0.10.53: 2198+ A? pgbouncer-airflow-euw-dev-db.pgbouncer.svc.cluster.local. (74)
09:29:00.319474 IP 10.100.200.247.57044 > 10.200.0.10.53: 62006+ AAAA? pgbouncer-airflow-euw-dev-db.pgbouncer.svc.cluster.local. (74)
09:29:00.321337 IP 10.200.0.10.53 > 10.100.200.247.57044: 2198 1/0/0 A 10.200.200.112 (146)
09:29:00.321339 IP 10.200.0.10.53 > 10.100.200.247.57044: 62006 0/1/0 (167)
09:29:00.355714 IP 10.100.200.247.34684 > 10.200.0.10.53: 46286+ A? pgbouncer-airflow-euw-dev-db.pgbouncer.svc.cluster.local. (74)
09:29:00.355770 IP 10.100.200.247.34684 > 10.200.0.10.53: 29557+ AAAA? pgbouncer-airflow-euw-dev-db.pgbouncer.svc.cluster.local. (74)
09:29:00.357838 IP 10.200.0.10.53 > 10.100.200.247.34684: 29557 0/1/0 (167)
09:29:00.357838 IP 10.200.0.10.53 > 10.100.200.247.34684: 46286 1/0/0 A 10.200.200.112 (146)
09:29:00.390860 IP 10.100.200.247.60024 > 10.200.0.10.53: 19617+ A? pgbouncer-airflow-euw-dev-db.pgbouncer.svc.cluster.local. (74)
09:29:00.390923 IP 10.100.200.247.60024 > 10.200.0.10.53: 64474+ AAAA? pgbouncer-airflow-euw-dev-db.pgbouncer.svc.cluster.local. (74)
09:29:00.393177 IP 10.200.0.10.53 > 10.100.200.247.60024: 64474 0/1/0 (167)
09:29:00.393210 IP 10.200.0.10.53 > 10.100.200.247.60024: 19617 1/0/0 A 10.200.200.112 (146)
09:29:00.421311 IP 10.100.200.247.42556 > 10.200.0.10.53: 36990+ A? pgbouncer-airflow-euw-dev-db.pgbouncer.svc.cluster.local. (74)
09:29:00.421377 IP 10.100.200.247.42556 > 10.200.0.10.53: 26409+ AAAA? pgbouncer-airflow-euw-dev-db.pgbouncer.svc.cluster.local. (74)
09:29:00.423730 IP 10.200.0.10.53 > 10.100.200.247.42556: 36990 1/0/0 A 10.200.200.112 (146)
09:29:00.423732 IP 10.200.0.10.53 > 10.100.200.247.42556: 26409 0/1/0 (167)
09:29:00.453076 IP 10.100.200.247.50759 > 10.200.0.10.53: 21426+ A? pgbouncer-airflow-euw-dev-db.pgbouncer.svc.cluster.local. (74)
09:29:00.453142 IP 10.100.200.247.50759 > 10.200.0.10.53: 14802+ AAAA? pgbouncer-airflow-euw-dev-db.pgbouncer.svc.cluster.local. (74)
09:29:00.455100 IP 10.200.0.10.53 > 10.100.200.247.50759: 21426 1/0/0 A 10.200.200.112 (146)
09:29:00.455115 IP 10.200.0.10.53 > 10.100.200.247.50759: 14802 0/1/0 (167)
09:29:00.490768 IP 10.100.200.247.48317 > 10.200.0.10.53: 42795+ A? pgbouncer-airflow-euw-dev-db.pgbouncer.svc.cluster.local. (74)
09:29:00.490831 IP 10.100.200.247.48317 > 10.200.0.10.53: 24978+ AAAA? pgbouncer-airflow-euw-dev-db.pgbouncer.svc.cluster.local. (74)
09:29:00.494554 IP 10.200.0.10.53 > 10.100.200.247.48317: 24978 0/1/0 (167)
09:29:00.494582 IP 10.200.0.10.53 > 10.100.200.247.48317: 42795 1/0/0 A 10.200.200.112 (146)
09:29:00.523603 IP 10.100.200.247.54854 > 10.200.0.10.53: 46801+ A? pgbouncer-airflow-euw-dev-db.pgbouncer.svc.cluster.local. (74)
09:29:00.523690 IP 10.100.200.247.54854 > 10.200.0.10.53: 37146+ AAAA? pgbouncer-airflow-euw-dev-db.pgbouncer.svc.cluster.local. (74)
09:29:00.526713 IP 10.200.0.10.53 > 10.100.200.247.54854: 37146 0/1/0 (167)
09:29:00.526730 IP 10.200.0.10.53 > 10.100.200.247.54854: 46801 1/0/0 A 10.200.200.112 (146)
09:29:00.554112 IP 10.100.200.247.34961 > 10.200.0.10.53: 32897+ A? pgbouncer-airflow-euw-dev-db.pgbouncer.svc.cluster.local. (74)
09:29:00.554166 IP 10.100.200.247.34961 > 10.200.0.10.53: 7667+ AAAA? pgbouncer-airflow-euw-dev-db.pgbouncer.svc.cluster.local. (74)
09:29:00.555974 IP 10.200.0.10.53 > 10.100.200.247.34961: 7667 0/1/0 (167)
09:29:00.555990 IP 10.200.0.10.53 > 10.100.200.247.34961: 32897 1/0/0 A 10.200.200.112 (146)
09:29:00.588966 IP 10.100.200.247.46028 > 10.200.0.10.53: 4022+ A? pgbouncer-airflow-euw-dev-db.pgbouncer.svc.cluster.local. (74)
09:29:00.589048 IP 10.100.200.247.46028 > 10.200.0.10.53: 3970+ AAAA? pgbouncer-airflow-euw-dev-db.pgbouncer.svc.cluster.local. (74)
09:29:00.590887 IP 10.200.0.10.53 > 10.100.200.247.46028: 3970 0/1/0 (167)
09:29:00.590905 IP 10.200.0.10.53 > 10.100.200.247.46028: 4022 1/0/0 A 10.200.200.112 (146)
09:29:00.618235 IP 10.100.200.247.51179 > 10.200.0.10.53: 55383+ A? pgbouncer-airflow-euw-dev-db.pgbouncer.svc.cluster.local. (74)
09:29:00.618305 IP 10.100.200.247.51179 > 10.200.0.10.53: 40501+ AAAA? pgbouncer-airflow-euw-dev-db.pgbouncer.svc.cluster.local. (74)
09:29:00.620365 IP 10.200.0.10.53 > 10.100.200.247.51179: 40501 0/1/0 (167)
09:29:00.620380 IP 10.200.0.10.53 > 10.100.200.247.51179: 55383 1/0/0 A 10.200.200.112 (146)
09:29:00.650466 IP 10.100.200.247.50063 > 10.200.0.10.53: 54127+ A? pgbouncer-airflow-euw-dev-db.pgbouncer.svc.cluster.local. (74)
09:29:00.650531 IP 10.100.200.247.50063 > 10.200.0.10.53: 60593+ AAAA? pgbouncer-airflow-euw-dev-db.pgbouncer.svc.cluster.local. (74)
09:29:00.652774 IP 10.200.0.10.53 > 10.100.200.247.50063: 60593 0/1/0 (167)
09:29:00.652801 IP 10.200.0.10.53 > 10.100.200.247.50063: 54127 1/0/0 A 10.200.200.112 (146)
09:29:00.684672 IP 10.100.200.247.53584 > 10.200.0.10.53: 57324+ A? pgbouncer-airflow-euw-dev-db.pgbouncer.svc.cluster.local. (74)
09:29:00.684724 IP 10.100.200.247.53584 > 10.200.0.10.53: 22065+ AAAA? pgbouncer-airflow-euw-dev-db.pgbouncer.svc.cluster.local. (74)
09:29:00.688331 IP 10.200.0.10.53 > 10.100.200.247.53584: 22065 0/1/0 (167)
09:29:00.688341 IP 10.200.0.10.53 > 10.100.200.247.53584: 57324 1/0/0 A 10.200.200.112 (146)
09:29:00.723749 IP 10.100.200.247.54237 > 10.200.0.10.53: 43322+ A? pgbouncer-airflow-euw-dev-db.pgbouncer.svc.cluster.local. (74)
09:29:00.723804 IP 10.100.200.247.54237 > 10.200.0.10.53: 58958+ AAAA? pgbouncer-airflow-euw-dev-db.pgbouncer.svc.cluster.local. (74)
09:29:00.725904 IP 10.200.0.10.53 > 10.100.200.247.54237: 43322 1/0/0 A 10.200.200.112 (146)
09:29:00.725923 IP 10.200.0.10.53 > 10.100.200.247.54237: 58958 0/1/0 (167)
09:29:00.826362 IP 10.100.200.247.48896 > 10.200.0.10.53: 3589+ A? pgbouncer-airflow-euw-dev-db.pgbouncer.svc.cluster.local. (74)
09:29:00.826421 IP 10.100.200.247.48896 > 10.200.0.10.53: 10697+ AAAA? pgbouncer-airflow-euw-dev-db.pgbouncer.svc.cluster.local. (74)
09:29:00.828172 IP 10.200.0.10.53 > 10.100.200.247.48896: 10697 0/1/0 (167)
09:29:00.828182 IP 10.200.0.10.53 > 10.100.200.247.48896: 3589 1/0/0 A 10.200.200.112 (146)
09:29:00.861881 IP 10.100.200.247.47879 > 10.200.0.10.53: 51732+ A? pgbouncer-airflow-euw-dev-db.pgbouncer.svc.cluster.local. (74)
09:29:00.861946 IP 10.100.200.247.47879 > 10.200.0.10.53: 46450+ AAAA? pgbouncer-airflow-euw-dev-db.pgbouncer.svc.cluster.local. (74)
09:29:00.864136 IP 10.200.0.10.53 > 10.100.200.247.47879: 46450 0/1/0 (167)
09:29:00.864172 IP 10.200.0.10.53 > 10.100.200.247.47879: 51732 1/0/0 A 10.200.200.112 (146)
09:29:00.894109 IP 10.100.200.247.49421 > 10.200.0.10.53: 9609+ A? pgbouncer-airflow-euw-dev-db.pgbouncer.svc.cluster.local. (74)
09:29:00.894167 IP 10.100.200.247.49421 > 10.200.0.10.53: 52653+ AAAA? pgbouncer-airflow-euw-dev-db.pgbouncer.svc.cluster.local. (74)
09:29:00.896140 IP 10.200.0.10.53 > 10.100.200.247.49421: 52653 0/1/0 (167)
09:29:00.896240 IP 10.200.0.10.53 > 10.100.200.247.49421: 9609 1/0/0 A 10.200.200.112 (146)
09:29:00.928972 IP 10.100.200.247.37031 > 10.200.0.10.53: 58192+ A? pgbouncer-airflow-euw-dev-db.pgbouncer.svc.cluster.local. (74)
09:29:00.929045 IP 10.100.200.247.37031 > 10.200.0.10.53: 48640+ AAAA? pgbouncer-airflow-euw-dev-db.pgbouncer.svc.cluster.local. (74)
09:29:00.931282 IP 10.200.0.10.53 > 10.100.200.247.37031: 48640 0/1/0 (167)
09:29:00.931299 IP 10.200.0.10.53 > 10.100.200.247.37031: 58192 1/0/0 A 10.200.200.112 (146)
09:29:00.964688 IP 10.100.200.247.58823 > 10.200.0.10.53: 57729+ A? pgbouncer-airflow-euw-dev-db.pgbouncer.svc.cluster.local. (74)
09:29:00.964739 IP 10.100.200.247.58823 > 10.200.0.10.53: 64857+ AAAA? pgbouncer-airflow-euw-dev-db.pgbouncer.svc.cluster.local. (74)
09:29:00.966691 IP 10.200.0.10.53 > 10.100.200.247.58823: 64857 0/1/0 (167)
09:29:00.966730 IP 10.200.0.10.53 > 10.100.200.247.58823: 57729 1/0/0 A 10.200.200.112 (146)
09:29:00.997130 IP 10.100.200.247.47826 > 10.200.0.10.53: 52850+ A? pgbouncer-airflow-euw-dev-db.pgbouncer.svc.cluster.local. (74)
09:29:00.997188 IP 10.100.200.247.47826 > 10.200.0.10.53: 16793+ AAAA? pgbouncer-airflow-euw-dev-db.pgbouncer.svc.cluster.local. (74)
09:29:00.999238 IP 10.200.0.10.53 > 10.100.200.247.47826: 16793 0/1/0 (167)
09:29:00.999248 IP 10.200.0.10.53 > 10.100.200.247.47826: 52850 1/0/0 A 10.200.200.112 (146)
09:29:01.044733 IP 10.100.200.247.35742 > 10.200.0.10.53: 56779+ A? pgbouncer-airflow-euw-dev-db.pgbouncer.svc.cluster.local. (74)
09:29:01.044859 IP 10.100.200.247.35742 > 10.200.0.10.53: 13070+ AAAA? pgbouncer-airflow-euw-dev-db.pgbouncer.svc.cluster.local. (74)
09:29:01.046728 IP 10.200.0.10.53 > 10.100.200.247.35742: 56779 1/0/0 A 10.200.200.112 (146)
09:29:01.046746 IP 10.200.0.10.53 > 10.100.200.247.35742: 13070 0/1/0 (167)
09:29:01.077869 IP 10.100.200.247.55998 > 10.200.0.10.53: 16865+ A? pgbouncer-airflow-euw-dev-db.pgbouncer.svc.cluster.local. (74)
09:29:01.077970 IP 10.100.200.247.55998 > 10.200.0.10.53: 26565+ AAAA? pgbouncer-airflow-euw-dev-db.pgbouncer.svc.cluster.local. (74)
09:29:01.079701 IP 10.200.0.10.53 > 10.100.200.247.55998: 16865 1/0/0 A 10.200.200.112 (146)
09:29:01.079711 IP 10.200.0.10.53 > 10.100.200.247.55998: 26565 0/1/0 (167)
09:29:01.107840 IP 10.100.200.247.37961 > 10.200.0.10.53: 33957+ A? pgbouncer-airflow-euw-dev-db.pgbouncer.svc.cluster.local. (74)
09:29:01.107951 IP 10.100.200.247.37961 > 10.200.0.10.53: 28317+ AAAA? pgbouncer-airflow-euw-dev-db.pgbouncer.svc.cluster.local. (74)
09:29:01.110441 IP 10.200.0.10.53 > 10.100.200.247.37961: 28317 0/1/0 (167)
09:29:01.110464 IP 10.200.0.10.53 > 10.100.200.247.37961: 33957* 1/0/0 A 10.200.200.112 (146)
09:29:01.152081 IP 10.100.200.247.55144 > 10.200.0.10.53: 33531+ A? pgbouncer-airflow-euw-dev-db.pgbouncer.svc.cluster.local. (74)
09:29:01.152187 IP 10.100.200.247.55144 > 10.200.0.10.53: 14441+ AAAA? pgbouncer-airflow-euw-dev-db.pgbouncer.svc.cluster.local. (74)
09:29:01.154262 IP 10.200.0.10.53 > 10.100.200.247.55144: 14441 0/1/0 (167)
09:29:01.154277 IP 10.200.0.10.53 > 10.100.200.247.55144: 33531 1/0/0 A 10.200.200.112 (146)
09:29:01.188236 IP 10.100.200.247.55963 > 10.200.0.10.53: 25510+ A? pgbouncer-airflow-euw-dev-db.pgbouncer.svc.cluster.local. (74)
09:29:01.188362 IP 10.100.200.247.55963 > 10.200.0.10.53: 47091+ AAAA? pgbouncer-airflow-euw-dev-db.pgbouncer.svc.cluster.local. (74)
09:29:01.190470 IP 10.200.0.10.53 > 10.100.200.247.55963: 47091 0/1/0 (167)
09:29:01.190491 IP 10.200.0.10.53 > 10.100.200.247.55963: 25510 1/0/0 A 10.200.200.112 (146)
09:29:01.219463 IP 10.100.200.247.55191 > 10.200.0.10.53: 28195+ A? pgbouncer-airflow-euw-dev-db.pgbouncer.svc.cluster.local. (74)
09:29:01.219621 IP 10.100.200.247.55191 > 10.200.0.10.53: 62571+ AAAA? pgbouncer-airflow-euw-dev-db.pgbouncer.svc.cluster.local. (74)
09:29:01.221717 IP 10.200.0.10.53 > 10.100.200.247.55191: 62571 0/1/0 (167)
09:29:01.221725 IP 10.200.0.10.53 > 10.100.200.247.55191: 28195 1/0/0 A 10.200.200.112 (146)
09:29:01.256330 IP 10.100.200.247.50407 > 10.200.0.10.53: 25084+ A? pgbouncer-airflow-euw-dev-db.pgbouncer.svc.cluster.local. (74)
09:29:01.256443 IP 10.100.200.247.50407 > 10.200.0.10.53: 17565+ AAAA? pgbouncer-airflow-euw-dev-db.pgbouncer.svc.cluster.local. (74)
09:29:01.258128 IP 10.200.0.10.53 > 10.100.200.247.50407: 17565 0/1/0 (167)
09:29:01.258148 IP 10.200.0.10.53 > 10.100.200.247.50407: 25084 1/0/0 A 10.200.200.112 (146)
09:29:01.289747 IP 10.100.200.247.56197 > 10.200.0.10.53: 34070+ A? pgbouncer-airflow-euw-dev-db.pgbouncer.svc.cluster.local. (74)
09:29:01.289821 IP 10.100.200.247.56197 > 10.200.0.10.53: 41638+ AAAA? pgbouncer-airflow-euw-dev-db.pgbouncer.svc.cluster.local. (74)
09:29:01.291671 IP 10.200.0.10.53 > 10.100.200.247.56197: 41638 0/1/0 (167)
09:29:01.291685 IP 10.200.0.10.53 > 10.100.200.247.56197: 34070 1/0/0 A 10.200.200.112 (146)
09:29:01.324937 IP 10.100.200.247.59659 > 10.200.0.10.53: 3412+ A? pgbouncer-airflow-euw-dev-db.pgbouncer.svc.cluster.local. (74)
09:29:01.325101 IP 10.100.200.247.59659 > 10.200.0.10.53: 20500+ AAAA? pgbouncer-airflow-euw-dev-db.pgbouncer.svc.cluster.local. (74)
09:29:01.328673 IP 10.200.0.10.53 > 10.100.200.247.59659: 3412 1/0/0 A 10.200.200.112 (146)
09:29:01.328689 IP 10.200.0.10.53 > 10.100.200.247.59659: 20500 0/1/0 (167)
09:29:01.368100 IP 10.100.200.247.55140 > 10.200.0.10.53: 2813+ A? pgbouncer-airflow-euw-dev-db.pgbouncer.svc.cluster.local. (74)
09:29:01.368205 IP 10.100.200.247.55140 > 10.200.0.10.53: 20981+ AAAA? pgbouncer-airflow-euw-dev-db.pgbouncer.svc.cluster.local. (74)
09:29:01.370158 IP 10.200.0.10.53 > 10.100.200.247.55140: 20981 0/1/0 (167)
09:29:01.370183 IP 10.200.0.10.53 > 10.100.200.247.55140: 2813 1/0/0 A 10.200.200.112 (146)
09:29:01.404795 IP 10.100.200.247.52141 > 10.200.0.10.53: 29936+ A? pgbouncer-airflow-euw-dev-db.pgbouncer.svc.cluster.local. (74)
09:29:01.404862 IP 10.100.200.247.52141 > 10.200.0.10.53: 13052+ AAAA? pgbouncer-airflow-euw-dev-db.pgbouncer.svc.cluster.local. (74)
09:29:01.406837 IP 10.200.0.10.53 > 10.100.200.247.52141: 13052 0/1/0 (167)
09:29:01.406856 IP 10.200.0.10.53 > 10.100.200.247.52141: 29936 1/0/0 A 10.200.200.112 (146)
09:29:01.443119 IP 10.100.200.247.49170 > 10.200.0.10.53: 28524+ A? pgbouncer-airflow-euw-dev-db.pgbouncer.svc.cluster.local. (74)
09:29:01.443222 IP 10.100.200.247.49170 > 10.200.0.10.53: 16621+ AAAA? pgbouncer-airflow-euw-dev-db.pgbouncer.svc.cluster.local. (74)
09:29:01.445056 IP 10.200.0.10.53 > 10.100.200.247.49170: 16621 0/1/0 (167)
09:29:01.445066 IP 10.200.0.10.53 > 10.100.200.247.49170: 28524 1/0/0 A 10.200.200.112 (146)
09:29:01.475876 IP 10.100.200.247.59619 > 10.200.0.10.53: 35719+ A? pgbouncer-airflow-euw-dev-db.pgbouncer.svc.cluster.local. (74)
09:29:01.475937 IP 10.100.200.247.59619 > 10.200.0.10.53: 564+ AAAA? pgbouncer-airflow-euw-dev-db.pgbouncer.svc.cluster.local. (74)
09:29:01.477774 IP 10.200.0.10.53 > 10.100.200.247.59619: 564 0/1/0 (167)
09:29:01.477788 IP 10.200.0.10.53 > 10.100.200.247.59619: 35719 1/0/0 A 10.200.200.112 (146)
09:29:01.506629 IP 10.100.200.247.51631 > 10.200.0.10.53: 34229+ A? pgbouncer-airflow-euw-dev-db.pgbouncer.svc.cluster.local. (74)
09:29:01.506697 IP 10.100.200.247.51631 > 10.200.0.10.53: 34116+ AAAA? pgbouncer-airflow-euw-dev-db.pgbouncer.svc.cluster.local. (74)
09:29:01.508538 IP 10.200.0.10.53 > 10.100.200.247.51631: 34116 0/1/0 (167)
09:29:01.508554 IP 10.200.0.10.53 > 10.100.200.247.51631: 34229 1/0/0 A 10.200.200.112 (146)
09:29:01.540604 IP 10.100.200.247.48778 > 10.200.0.10.53: 59000+ A? pgbouncer-airflow-euw-dev-db.pgbouncer.svc.cluster.local. (74)
09:29:01.540734 IP 10.100.200.247.48778 > 10.200.0.10.53: 42942+ AAAA? pgbouncer-airflow-euw-dev-db.pgbouncer.svc.cluster.local. (74)
09:29:01.542745 IP 10.200.0.10.53 > 10.100.200.247.48778: 42942 0/1/0 (167)
09:29:01.542775 IP 10.200.0.10.53 > 10.100.200.247.48778: 59000 1/0/0 A 10.200.200.112 (146)
09:29:01.571626 IP 10.100.200.247.51915 > 10.200.0.10.53: 590+ A? pgbouncer-airflow-euw-dev-db.pgbouncer.svc.cluster.local. (74)
09:29:01.571764 IP 10.100.200.247.51915 > 10.200.0.10.53: 14825+ AAAA? pgbouncer-airflow-euw-dev-db.pgbouncer.svc.cluster.local. (74)
09:29:01.573613 IP 10.200.0.10.53 > 10.100.200.247.51915: 590 1/0/0 A 10.200.200.112 (146)
09:29:01.573617 IP 10.200.0.10.53 > 10.100.200.247.51915: 14825 0/1/0 (167)
09:29:01.602502 IP 10.100.200.247.53150 > 10.200.0.10.53: 20321+ A? pgbouncer-airflow-euw-dev-db.pgbouncer.svc.cluster.local. (74)
09:29:01.602585 IP 10.100.200.247.53150 > 10.200.0.10.53: 41189+ AAAA? pgbouncer-airflow-euw-dev-db.pgbouncer.svc.cluster.local. (74)
09:29:01.604570 IP 10.200.0.10.53 > 10.100.200.247.53150: 20321 1/0/0 A 10.200.200.112 (146)
09:29:01.604578 IP 10.200.0.10.53 > 10.100.200.247.53150: 41189 0/1/0 (167)
09:29:01.641903 IP 10.100.200.247.40621 > 10.200.0.10.53: 55051+ A? pgbouncer-airflow-euw-dev-db.pgbouncer.svc.cluster.local. (74)
09:29:01.642011 IP 10.100.200.247.40621 > 10.200.0.10.53: 52540+ AAAA? pgbouncer-airflow-euw-dev-db.pgbouncer.svc.cluster.local. (74)
09:29:01.644252 IP 10.200.0.10.53 > 10.100.200.247.40621: 52540 0/1/0 (167)
09:29:01.644269 IP 10.200.0.10.53 > 10.100.200.247.40621: 55051 1/0/0 A 10.200.200.112 (146)
09:29:01.680419 IP 10.100.200.247.32913 > 10.200.0.10.53: 60962+ A? pgbouncer-airflow-euw-dev-db.pgbouncer.svc.cluster.local. (74)
09:29:01.680487 IP 10.100.200.247.32913 > 10.200.0.10.53: 4886+ AAAA? pgbouncer-airflow-euw-dev-db.pgbouncer.svc.cluster.local. (74)
09:29:01.682734 IP 10.200.0.10.53 > 10.100.200.247.32913: 4886 0/1/0 (167)
09:29:01.682751 IP 10.200.0.10.53 > 10.100.200.247.32913: 60962 1/0/0 A 10.200.200.112 (146)
09:29:01.710704 IP 10.100.200.247.35604 > 10.200.0.10.53: 41468+ A? pgbouncer-airflow-euw-dev-db.pgbouncer.svc.cluster.local. (74)
09:29:01.710772 IP 10.100.200.247.35604 > 10.200.0.10.53: 56814+ AAAA? pgbouncer-airflow-euw-dev-db.pgbouncer.svc.cluster.local. (74)
09:29:01.712571 IP 10.200.0.10.53 > 10.100.200.247.35604: 41468 1/0/0 A 10.200.200.112 (146)
09:29:01.712664 IP 10.200.0.10.53 > 10.100.200.247.35604: 56814 0/1/0 (167)
09:29:01.744868 IP 10.100.200.247.37797 > 10.200.0.10.53: 48733+ A? pgbouncer-airflow-euw-dev-db.pgbouncer.svc.cluster.local. (74)
09:29:01.744978 IP 10.100.200.247.37797 > 10.200.0.10.53: 30936+ AAAA? pgbouncer-airflow-euw-dev-db.pgbouncer.svc.cluster.local. (74)
09:29:01.746837 IP 10.200.0.10.53 > 10.100.200.247.37797: 48733 1/0/0 A 10.200.200.112 (146)
09:29:01.746853 IP 10.200.0.10.53 > 10.100.200.247.37797: 30936 0/1/0 (167)
09:29:01.780351 IP 10.100.200.247.59084 > 10.200.0.10.53: 11709+ A? pgbouncer-airflow-euw-dev-db.pgbouncer.svc.cluster.local. (74)
09:29:01.780444 IP 10.100.200.247.59084 > 10.200.0.10.53: 41646+ AAAA? pgbouncer-airflow-euw-dev-db.pgbouncer.svc.cluster.local. (74)
09:29:01.782787 IP 10.200.0.10.53 > 10.100.200.247.59084: 41646 0/1/0 (167)
09:29:01.782804 IP 10.200.0.10.53 > 10.100.200.247.59084: 11709 1/0/0 A 10.200.200.112 (146)
09:29:01.810350 IP 10.100.200.247.43406 > 10.200.0.10.53: 53508+ A? pgbouncer-airflow-euw-dev-db.pgbouncer.svc.cluster.local. (74)
09:29:01.810407 IP 10.100.200.247.43406 > 10.200.0.10.53: 25958+ AAAA? pgbouncer-airflow-euw-dev-db.pgbouncer.svc.cluster.local. (74)
09:29:01.813785 IP 10.200.0.10.53 > 10.100.200.247.43406: 53508 1/0/0 A 10.200.200.112 (146)
09:29:01.813807 IP 10.200.0.10.53 > 10.100.200.247.43406: 25958 0/1/0 (167)
09:29:01.851781 IP 10.100.200.247.51987 > 10.200.0.10.53: 33832+ A? pgbouncer-airflow-euw-dev-db.pgbouncer.svc.cluster.local. (74)
09:29:01.851845 IP 10.100.200.247.51987 > 10.200.0.10.53: 9210+ AAAA? pgbouncer-airflow-euw-dev-db.pgbouncer.svc.cluster.local. (74)
09:29:01.853790 IP 10.200.0.10.53 > 10.100.200.247.51987: 33832 1/0/0 A 10.200.200.112 (146)
09:29:01.853793 IP 10.200.0.10.53 > 10.100.200.247.51987: 9210 0/1/0 (167)
09:29:01.886931 IP 10.100.200.247.54801 > 10.200.0.10.53: 31474+ A? pgbouncer-airflow-euw-dev-db.pgbouncer.svc.cluster.local. (74)
09:29:01.887030 IP 10.100.200.247.54801 > 10.200.0.10.53: 28421+ AAAA? pgbouncer-airflow-euw-dev-db.pgbouncer.svc.cluster.local. (74)
09:29:01.888818 IP 10.200.0.10.53 > 10.100.200.247.54801: 28421 0/1/0 (167)
09:29:01.888827 IP 10.200.0.10.53 > 10.100.200.247.54801: 31474 1/0/0 A 10.200.200.112 (146)
09:29:01.922691 IP 10.100.200.247.36771 > 10.200.0.10.53: 43420+ A? pgbouncer-airflow-euw-dev-db.pgbouncer.svc.cluster.local. (74)
09:29:01.922787 IP 10.100.200.247.36771 > 10.200.0.10.53: 58946+ AAAA? pgbouncer-airflow-euw-dev-db.pgbouncer.svc.cluster.local. (74)
09:29:01.924609 IP 10.200.0.10.53 > 10.100.200.247.36771: 58946 0/1/0 (167)
09:29:01.924619 IP 10.200.0.10.53 > 10.100.200.247.36771: 43420 1/0/0 A 10.200.200.112 (146)
09:29:01.957472 IP 10.100.200.247.45249 > 10.200.0.10.53: 16851+ A? pgbouncer-airflow-euw-dev-db.pgbouncer.svc.cluster.local. (74)
09:29:01.957543 IP 10.100.200.247.45249 > 10.200.0.10.53: 5490+ AAAA? pgbouncer-airflow-euw-dev-db.pgbouncer.svc.cluster.local. (74)
09:29:01.959700 IP 10.200.0.10.53 > 10.100.200.247.45249: 5490 0/1/0 (167)
09:29:01.959720 IP 10.200.0.10.53 > 10.100.200.247.45249: 16851 1/0/0 A 10.200.200.112 (146)
09:29:01.996308 IP 10.100.200.247.56833 > 10.200.0.10.53: 23773+ A? pgbouncer-airflow-euw-dev-db.pgbouncer.svc.cluster.local. (74)
09:29:01.996336 IP 10.100.200.247.56833 > 10.200.0.10.53: 24147+ AAAA? pgbouncer-airflow-euw-dev-db.pgbouncer.svc.cluster.local. (74)
09:29:01.998247 IP 10.200.0.10.53 > 10.100.200.247.56833: 24147 0/1/0 (167)
09:29:01.998253 IP 10.200.0.10.53 > 10.100.200.247.56833: 23773 1/0/0 A 10.200.200.112 (146)
09:29:02.026643 IP 10.100.200.247.48686 > 10.200.0.10.53: 60763+ A? pgbouncer-airflow-euw-dev-db.pgbouncer.svc.cluster.local. (74)
09:29:02.026734 IP 10.100.200.247.48686 > 10.200.0.10.53: 35851+ AAAA? pgbouncer-airflow-euw-dev-db.pgbouncer.svc.cluster.local. (74)
09:29:02.028751 IP 10.200.0.10.53 > 10.100.200.247.48686: 35851 0/1/0 (167)
09:29:02.028751 IP 10.200.0.10.53 > 10.100.200.247.48686: 60763 1/0/0 A 10.200.200.112 (146)
09:29:02.057253 IP 10.100.200.247.59695 > 10.200.0.10.53: 35924+ A? pgbouncer-airflow-euw-dev-db.pgbouncer.svc.cluster.local. (74)
09:29:02.057315 IP 10.100.200.247.59695 > 10.200.0.10.53: 64427+ AAAA? pgbouncer-airflow-euw-dev-db.pgbouncer.svc.cluster.local. (74)
09:29:02.059109 IP 10.200.0.10.53 > 10.100.200.247.59695: 64427 0/1/0 (167)
09:29:02.059117 IP 10.200.0.10.53 > 10.100.200.247.59695: 35924 1/0/0 A 10.200.200.112 (146)
09:29:02.090157 IP 10.100.200.247.53791 > 10.200.0.10.53: 13072+ A? pgbouncer-airflow-euw-dev-db.pgbouncer.svc.cluster.local. (74)
09:29:02.090215 IP 10.100.200.247.53791 > 10.200.0.10.53: 18819+ AAAA? pgbouncer-airflow-euw-dev-db.pgbouncer.svc.cluster.local. (74)
09:29:02.092175 IP 10.200.0.10.53 > 10.100.200.247.53791: 13072 1/0/0 A 10.200.200.112 (146)
09:29:02.092187 IP 10.200.0.10.53 > 10.100.200.247.53791: 18819 0/1/0 (167)
09:29:02.120418 IP 10.100.200.247.57662 > 10.200.0.10.53: 54438+ A? pgbouncer-airflow-euw-dev-db.pgbouncer.svc.cluster.local. (74)
09:29:02.120483 IP 10.100.200.247.57662 > 10.200.0.10.53: 58322+ AAAA? pgbouncer-airflow-euw-dev-db.pgbouncer.svc.cluster.local. (74)
09:29:02.122487 IP 10.200.0.10.53 > 10.100.200.247.57662: 54438 1/0/0 A 10.200.200.112 (146)
09:29:02.122487 IP 10.200.0.10.53 > 10.100.200.247.57662: 58322 0/1/0 (167)
09:29:02.154529 IP 10.100.200.247.33675 > 10.200.0.10.53: 61269+ A? pgbouncer-airflow-euw-dev-db.pgbouncer.svc.cluster.local. (74)
09:29:02.154574 IP 10.100.200.247.33675 > 10.200.0.10.53: 43232+ AAAA? pgbouncer-airflow-euw-dev-db.pgbouncer.svc.cluster.local. (74)
09:29:02.157105 IP 10.200.0.10.53 > 10.100.200.247.33675: 43232 0/1/0 (167)
09:29:02.157119 IP 10.200.0.10.53 > 10.100.200.247.33675: 61269 1/0/0 A 10.200.200.112 (146)
09:29:02.191571 IP 10.100.200.247.50716 > 10.200.0.10.53: 49480+ A? pgbouncer-airflow-euw-dev-db.pgbouncer.svc.cluster.local. (74)
09:29:02.191735 IP 10.100.200.247.50716 > 10.200.0.10.53: 6842+ AAAA? pgbouncer-airflow-euw-dev-db.pgbouncer.svc.cluster.local. (74)
09:29:02.193717 IP 10.200.0.10.53 > 10.100.200.247.50716: 6842 0/1/0 (167)
09:29:02.193729 IP 10.200.0.10.53 > 10.100.200.247.50716: 49480 1/0/0 A 10.200.200.112 (146)
09:29:02.233479 IP 10.100.200.247.37615 > 10.200.0.10.53: 43918+ A? pgbouncer-airflow-euw-dev-db.pgbouncer.svc.cluster.local. (74)
09:29:02.233562 IP 10.100.200.247.37615 > 10.200.0.10.53: 16490+ AAAA? pgbouncer-airflow-euw-dev-db.pgbouncer.svc.cluster.local. (74)
09:29:02.235515 IP 10.200.0.10.53 > 10.100.200.247.37615: 16490 0/1/0 (167)
09:29:02.235531 IP 10.200.0.10.53 > 10.100.200.247.37615: 43918 1/0/0 A 10.200.200.112 (146)
09:29:02.271400 IP 10.100.200.247.48366 > 10.200.0.10.53: 12038+ A? pgbouncer-airflow-euw-dev-db.pgbouncer.svc.cluster.local. (74)
09:29:02.271456 IP 10.100.200.247.48366 > 10.200.0.10.53: 63144+ AAAA? pgbouncer-airflow-euw-dev-db.pgbouncer.svc.cluster.local. (74)
09:29:02.273986 IP 10.200.0.10.53 > 10.100.200.247.48366: 63144 0/1/0 (167)
09:29:02.274042 IP 10.200.0.10.53 > 10.100.200.247.48366: 12038 1/0/0 A 10.200.200.112 (146)
09:29:02.304611 IP 10.100.200.247.35109 > 10.200.0.10.53: 36644+ A? pgbouncer-airflow-euw-dev-db.pgbouncer.svc.cluster.local. (74)
09:29:02.304709 IP 10.100.200.247.35109 > 10.200.0.10.53: 42663+ AAAA? pgbouncer-airflow-euw-dev-db.pgbouncer.svc.cluster.local. (74)
09:29:02.306566 IP 10.200.0.10.53 > 10.100.200.247.35109: 42663 0/1/0 (167)
09:29:02.306590 IP 10.200.0.10.53 > 10.100.200.247.35109: 36644 1/0/0 A 10.200.200.112 (146)
09:29:02.339821 IP 10.100.200.247.55153 > 10.200.0.10.53: 20907+ A? pgbouncer-airflow-euw-dev-db.pgbouncer.svc.cluster.local. (74)
09:29:02.339885 IP 10.100.200.247.55153 > 10.200.0.10.53: 31932+ AAAA? pgbouncer-airflow-euw-dev-db.pgbouncer.svc.cluster.local. (74)
09:29:02.344887 IP 10.200.0.10.53 > 10.100.200.247.55153: 31932 0/1/0 (167)
09:29:02.344903 IP 10.200.0.10.53 > 10.100.200.247.55153: 20907 1/0/0 A 10.200.200.112 (146)
09:29:02.375282 IP 10.100.200.247.55219 > 10.200.0.10.53: 49587+ A? pgbouncer-airflow-euw-dev-db.pgbouncer.svc.cluster.local. (74)
09:29:02.375347 IP 10.100.200.247.55219 > 10.200.0.10.53: 49844+ AAAA? pgbouncer-airflow-euw-dev-db.pgbouncer.svc.cluster.local. (74)
09:29:02.377349 IP 10.200.0.10.53 > 10.100.200.247.55219: 49844 0/1/0 (167)
09:29:02.377367 IP 10.200.0.10.53 > 10.100.200.247.55219: 49587 1/0/0 A 10.200.200.112 (146)
09:29:02.404755 IP 10.100.200.247.51404 > 10.200.0.10.53: 60508+ A? pgbouncer-airflow-euw-dev-db.pgbouncer.svc.cluster.local. (74)
09:29:02.404815 IP 10.100.200.247.51404 > 10.200.0.10.53: 30478+ AAAA? pgbouncer-airflow-euw-dev-db.pgbouncer.svc.cluster.local. (74)
09:29:02.406591 IP 10.200.0.10.53 > 10.100.200.247.51404: 30478 0/1/0 (167)
09:29:02.406612 IP 10.200.0.10.53 > 10.100.200.247.51404: 60508 1/0/0 A 10.200.200.112 (146)
09:29:02.436217 IP 10.100.200.247.40108 > 10.200.0.10.53: 20618+ A? pgbouncer-airflow-euw-dev-db.pgbouncer.svc.cluster.local. (74)
09:29:02.436272 IP 10.100.200.247.40108 > 10.200.0.10.53: 24845+ AAAA? pgbouncer-airflow-euw-dev-db.pgbouncer.svc.cluster.local. (74)
09:29:02.438156 IP 10.200.0.10.53 > 10.100.200.247.40108: 20618 1/0/0 A 10.200.200.112 (146)
09:29:02.438175 IP 10.200.0.10.53 > 10.100.200.247.40108: 24845 0/1/0 (167)
09:29:02.466956 IP 10.100.200.247.49840 > 10.200.0.10.53: 48828+ A? pgbouncer-airflow-euw-dev-db.pgbouncer.svc.cluster.local. (74)
09:29:02.467032 IP 10.100.200.247.49840 > 10.200.0.10.53: 7030+ AAAA? pgbouncer-airflow-euw-dev-db.pgbouncer.svc.cluster.local. (74)
09:29:02.469269 IP 10.200.0.10.53 > 10.100.200.247.49840: 7030 0/1/0 (167)
09:29:02.469269 IP 10.200.0.10.53 > 10.100.200.247.49840: 48828 1/0/0 A 10.200.200.112 (146)
09:29:02.503190 IP 10.100.200.247.36499 > 10.200.0.10.53: 62872+ A? pgbouncer-airflow-euw-dev-db.pgbouncer.svc.cluster.local. (74)
09:29:02.503314 IP 10.100.200.247.36499 > 10.200.0.10.53: 12493+ AAAA? pgbouncer-airflow-euw-dev-db.pgbouncer.svc.cluster.local. (74)
09:29:02.505306 IP 10.200.0.10.53 > 10.100.200.247.36499: 12493 0/1/0 (167)
09:29:02.505323 IP 10.200.0.10.53 > 10.100.200.247.36499: 62872 1/0/0 A 10.200.200.112 (146)
09:29:02.536089 IP 10.100.200.247.46776 > 10.200.0.10.53: 28159+ A? pgbouncer-airflow-euw-dev-db.pgbouncer.svc.cluster.local. (74)
09:29:02.536141 IP 10.100.200.247.46776 > 10.200.0.10.53: 23613+ AAAA? pgbouncer-airflow-euw-dev-db.pgbouncer.svc.cluster.local. (74)
09:29:02.537937 IP 10.200.0.10.53 > 10.100.200.247.46776: 23613 0/1/0 (167)
09:29:02.537952 IP 10.200.0.10.53 > 10.100.200.247.46776: 28159 1/0/0 A 10.200.200.112 (146)
09:29:02.564960 IP 10.100.200.247.59997 > 10.200.0.10.53: 26746+ A? pgbouncer-airflow-euw-dev-db.pgbouncer.svc.cluster.local. (74)
09:29:02.565106 IP 10.100.200.247.59997 > 10.200.0.10.53: 1219+ AAAA? pgbouncer-airflow-euw-dev-db.pgbouncer.svc.cluster.local. (74)
09:29:02.567105 IP 10.200.0.10.53 > 10.100.200.247.59997: 1219 0/1/0 (167)
09:29:02.567128 IP 10.200.0.10.53 > 10.100.200.247.59997: 26746 1/0/0 A 10.200.200.112 (146)
09:29:02.595048 IP 10.100.200.247.53793 > 10.200.0.10.53: 25298+ A? pgbouncer-airflow-euw-dev-db.pgbouncer.svc.cluster.local. (74)
09:29:02.595102 IP 10.100.200.247.53793 > 10.200.0.10.53: 12015+ AAAA? pgbouncer-airflow-euw-dev-db.pgbouncer.svc.cluster.local. (74)
09:29:02.596872 IP 10.200.0.10.53 > 10.100.200.247.53793: 12015 0/1/0 (167)
09:29:02.596886 IP 10.200.0.10.53 > 10.100.200.247.53793: 25298 1/0/0 A 10.200.200.112 (146)
09:29:02.630664 IP 10.100.200.247.56589 > 10.200.0.10.53: 9715+ A? pgbouncer-airflow-euw-dev-db.pgbouncer.svc.cluster.local. (74)
09:29:02.630770 IP 10.100.200.247.56589 > 10.200.0.10.53: 56942+ AAAA? pgbouncer-airflow-euw-dev-db.pgbouncer.svc.cluster.local. (74)
09:29:02.633068 IP 10.200.0.10.53 > 10.100.200.247.56589: 9715 1/0/0 A 10.200.200.112 (146)
09:29:02.633084 IP 10.200.0.10.53 > 10.100.200.247.56589: 56942 0/1/0 (167)
09:29:02.660475 IP 10.100.200.247.43428 > 10.200.0.10.53: 11019+ A? pgbouncer-airflow-euw-dev-db.pgbouncer.svc.cluster.local. (74)
09:29:02.660540 IP 10.100.200.247.43428 > 10.200.0.10.53: 12462+ AAAA? pgbouncer-airflow-euw-dev-db.pgbouncer.svc.cluster.local. (74)
09:29:02.662740 IP 10.200.0.10.53 > 10.100.200.247.43428: 12462 0/1/0 (167)
09:29:02.662757 IP 10.200.0.10.53 > 10.100.200.247.43428: 11019 1/0/0 A 10.200.200.112 (146)
09:29:02.694421 IP 10.100.200.247.40816 > 10.200.0.10.53: 34811+ A? pgbouncer-airflow-euw-dev-db.pgbouncer.svc.cluster.local. (74)
09:29:02.694468 IP 10.100.200.247.40816 > 10.200.0.10.53: 52559+ AAAA? pgbouncer-airflow-euw-dev-db.pgbouncer.svc.cluster.local. (74)
09:29:02.696505 IP 10.200.0.10.53 > 10.100.200.247.40816: 52559 0/1/0 (167)
09:29:02.696579 IP 10.200.0.10.53 > 10.100.200.247.40816: 34811 1/0/0 A 10.200.200.112 (146)
09:29:02.724559 IP 10.100.200.247.35098 > 10.200.0.10.53: 42714+ A? pgbouncer-airflow-euw-dev-db.pgbouncer.svc.cluster.local. (74)
09:29:02.724623 IP 10.100.200.247.35098 > 10.200.0.10.53: 42605+ AAAA? pgbouncer-airflow-euw-dev-db.pgbouncer.svc.cluster.local. (74)
09:29:02.726563 IP 10.200.0.10.53 > 10.100.200.247.35098: 42605 0/1/0 (167)
09:29:02.726571 IP 10.200.0.10.53 > 10.100.200.247.35098: 42714 1/0/0 A 10.200.200.112 (146)
09:29:02.773586 IP 10.100.200.247.43277 > 10.200.0.10.53: 42824+ A? pgbouncer-airflow-euw-dev-db.pgbouncer.svc.cluster.local. (74)
09:29:02.773801 IP 10.100.200.247.43277 > 10.200.0.10.53: 57904+ AAAA? pgbouncer-airflow-euw-dev-db.pgbouncer.svc.cluster.local. (74)
09:29:02.775705 IP 10.200.0.10.53 > 10.100.200.247.43277: 57904 0/1/0 (167)
09:29:02.775714 IP 10.200.0.10.53 > 10.100.200.247.43277: 42824 1/0/0 A 10.200.200.112 (146)
09:29:02.819486 IP 10.100.200.247.48793 > 10.200.0.10.53: 11107+ A? pgbouncer-airflow-euw-dev-db.pgbouncer.svc.cluster.local. (74)
09:29:02.819540 IP 10.100.200.247.48793 > 10.200.0.10.53: 19615+ AAAA? pgbouncer-airflow-euw-dev-db.pgbouncer.svc.cluster.local. (74)
09:29:02.821498 IP 10.200.0.10.53 > 10.100.200.247.48793: 19615 0/1/0 (167)
09:29:02.821545 IP 10.200.0.10.53 > 10.100.200.247.48793: 11107 1/0/0 A 10.200.200.112 (146)
09:29:02.856272 IP 10.100.200.247.59364 > 10.200.0.10.53: 11923+ A? pgbouncer-airflow-euw-dev-db.pgbouncer.svc.cluster.local. (74)
09:29:02.856341 IP 10.100.200.247.59364 > 10.200.0.10.53: 34534+ AAAA? pgbouncer-airflow-euw-dev-db.pgbouncer.svc.cluster.local. (74)
09:29:02.858404 IP 10.200.0.10.53 > 10.100.200.247.59364: 34534 0/1/0 (167)
09:29:02.858425 IP 10.200.0.10.53 > 10.100.200.247.59364: 11923 1/0/0 A 10.200.200.112 (146)
09:29:02.889077 IP 10.100.200.247.49608 > 10.200.0.10.53: 28095+ A? pgbouncer-airflow-euw-dev-db.pgbouncer.svc.cluster.local. (74)
09:29:02.889133 IP 10.100.200.247.49608 > 10.200.0.10.53: 39074+ AAAA? pgbouncer-airflow-euw-dev-db.pgbouncer.svc.cluster.local. (74)
09:29:02.890931 IP 10.200.0.10.53 > 10.100.200.247.49608: 28095 1/0/0 A 10.200.200.112 (146)
09:29:02.890948 IP 10.200.0.10.53 > 10.100.200.247.49608: 39074 0/1/0 (167)
09:29:02.930484 IP 10.100.200.247.59841 > 10.200.0.10.53: 33828+ A? pgbouncer-airflow-euw-dev-db.pgbouncer.svc.cluster.local. (74)
09:29:02.930545 IP 10.100.200.247.59841 > 10.200.0.10.53: 14515+ AAAA? pgbouncer-airflow-euw-dev-db.pgbouncer.svc.cluster.local. (74)
09:29:02.932714 IP 10.200.0.10.53 > 10.100.200.247.59841: 14515 0/1/0 (167)
09:29:02.932732 IP 10.200.0.10.53 > 10.100.200.247.59841: 33828 1/0/0 A 10.200.200.112 (146)
09:29:02.964836 IP 10.100.200.247.58029 > 10.200.0.10.53: 20243+ A? pgbouncer-airflow-euw-dev-db.pgbouncer.svc.cluster.local. (74)
09:29:02.964892 IP 10.100.200.247.58029 > 10.200.0.10.53: 53119+ AAAA? pgbouncer-airflow-euw-dev-db.pgbouncer.svc.cluster.local. (74)
09:29:02.966769 IP 10.200.0.10.53 > 10.100.200.247.58029: 20243 1/0/0 A 10.200.200.112 (146)
09:29:02.966780 IP 10.200.0.10.53 > 10.100.200.247.58029: 53119 0/1/0 (167)
09:29:02.995490 IP 10.100.200.247.56846 > 10.200.0.10.53: 49751+ A? pgbouncer-airflow-euw-dev-db.pgbouncer.svc.cluster.local. (74)
09:29:02.995625 IP 10.100.200.247.56846 > 10.200.0.10.53: 6970+ AAAA? pgbouncer-airflow-euw-dev-db.pgbouncer.svc.cluster.local. (74)
09:29:02.997799 IP 10.200.0.10.53 > 10.100.200.247.56846: 6970 0/1/0 (167)
09:29:02.997826 IP 10.200.0.10.53 > 10.100.200.247.56846: 49751 1/0/0 A 10.200.200.112 (146)
09:29:03.024083 IP 10.100.200.247.46038 > 10.200.0.10.53: 34857+ A? pgbouncer-airflow-euw-dev-db.pgbouncer.svc.cluster.local. (74)
09:29:03.024140 IP 10.100.200.247.46038 > 10.200.0.10.53: 43810+ AAAA? pgbouncer-airflow-euw-dev-db.pgbouncer.svc.cluster.local. (74)
09:29:03.026376 IP 10.200.0.10.53 > 10.100.200.247.46038: 34857 1/0/0 A 10.200.200.112 (146)
09:29:03.026378 IP 10.200.0.10.53 > 10.100.200.247.46038: 43810 0/1/0 (167)
09:29:03.056546 IP 10.100.200.247.58962 > 10.200.0.10.53: 47003+ A? pgbouncer-airflow-euw-dev-db.pgbouncer.svc.cluster.local. (74)
09:29:03.056666 IP 10.100.200.247.58962 > 10.200.0.10.53: 33060+ AAAA? pgbouncer-airflow-euw-dev-db.pgbouncer.svc.cluster.local. (74)
09:29:03.058598 IP 10.200.0.10.53 > 10.100.200.247.58962: 33060 0/1/0 (167)
09:29:03.058613 IP 10.200.0.10.53 > 10.100.200.247.58962: 47003 1/0/0 A 10.200.200.112 (146)
09:29:03.089082 IP 10.100.200.247.54347 > 10.200.0.10.53: 12412+ A? pgbouncer-airflow-euw-dev-db.pgbouncer.svc.cluster.local. (74)
09:29:03.089184 IP 10.100.200.247.54347 > 10.200.0.10.53: 57571+ AAAA? pgbouncer-airflow-euw-dev-db.pgbouncer.svc.cluster.local. (74)
09:29:03.091359 IP 10.200.0.10.53 > 10.100.200.247.54347: 12412 1/0/0 A 10.200.200.112 (146)
09:29:03.091480 IP 10.200.0.10.53 > 10.100.200.247.54347: 57571 0/1/0 (167)
09:29:03.121798 IP 10.100.200.247.39118 > 10.200.0.10.53: 39641+ A? pgbouncer-airflow-euw-dev-db.pgbouncer.svc.cluster.local. (74)
09:29:03.121942 IP 10.100.200.247.39118 > 10.200.0.10.53: 14303+ AAAA? pgbouncer-airflow-euw-dev-db.pgbouncer.svc.cluster.local. (74)
09:29:03.125515 IP 10.200.0.10.53 > 10.100.200.247.39118: 14303 0/1/0 (167)
09:29:03.125533 IP 10.200.0.10.53 > 10.100.200.247.39118: 39641 1/0/0 A 10.200.200.112 (146)
09:29:03.161872 IP 10.100.200.247.50514 > 10.200.0.10.53: 2260+ A? pgbouncer-airflow-euw-dev-db.pgbouncer.svc.cluster.local. (74)
09:29:03.161992 IP 10.100.200.247.50514 > 10.200.0.10.53: 5848+ AAAA? pgbouncer-airflow-euw-dev-db.pgbouncer.svc.cluster.local. (74)
09:29:03.163907 IP 10.200.0.10.53 > 10.100.200.247.50514: 5848 0/1/0 (167)
09:29:03.163920 IP 10.200.0.10.53 > 10.100.200.247.50514: 2260 1/0/0 A 10.200.200.112 (146)
09:29:03.196158 IP 10.100.200.247.53702 > 10.200.0.10.53: 12377+ A? pgbouncer-airflow-euw-dev-db.pgbouncer.svc.cluster.local. (74)
09:29:03.196268 IP 10.100.200.247.53702 > 10.200.0.10.53: 1516+ AAAA? pgbouncer-airflow-euw-dev-db.pgbouncer.svc.cluster.local. (74)
09:29:03.199053 IP 10.200.0.10.53 > 10.100.200.247.53702: 12377 1/0/0 A 10.200.200.112 (146)
09:29:03.199068 IP 10.200.0.10.53 > 10.100.200.247.53702: 1516 0/1/0 (167)
09:29:03.230187 IP 10.100.200.247.39953 > 10.200.0.10.53: 52959+ A? pgbouncer-airflow-euw-dev-db.pgbouncer.svc.cluster.local. (74)
09:29:03.230335 IP 10.100.200.247.39953 > 10.200.0.10.53: 14821+ AAAA? pgbouncer-airflow-euw-dev-db.pgbouncer.svc.cluster.local. (74)
09:29:03.232608 IP 10.200.0.10.53 > 10.100.200.247.39953: 14821 0/1/0 (167)
09:29:03.232608 IP 10.200.0.10.53 > 10.100.200.247.39953: 52959 1/0/0 A 10.200.200.112 (146)
09:29:03.265100 IP 10.100.200.247.38528 > 10.200.0.10.53: 25119+ A? pgbouncer-airflow-euw-dev-db.pgbouncer.svc.cluster.local. (74)
09:29:03.265212 IP 10.100.200.247.38528 > 10.200.0.10.53: 6508+ AAAA? pgbouncer-airflow-euw-dev-db.pgbouncer.svc.cluster.local. (74)
09:29:03.267517 IP 10.200.0.10.53 > 10.100.200.247.38528: 6508 0/1/0 (167)
09:29:03.267538 IP 10.200.0.10.53 > 10.100.200.247.38528: 25119 1/0/0 A 10.200.200.112 (146)
09:29:03.319641 IP 10.100.200.247.32941 > 10.200.0.10.53: 60465+ A? pgbouncer-airflow-euw-dev-db.pgbouncer.svc.cluster.local. (74)
09:29:03.319742 IP 10.100.200.247.32941 > 10.200.0.10.53: 29732+ AAAA? pgbouncer-airflow-euw-dev-db.pgbouncer.svc.cluster.local. (74)
09:29:03.321741 IP 10.200.0.10.53 > 10.100.200.247.32941: 60465 1/0/0 A 10.200.200.112 (146)
09:29:03.321771 IP 10.200.0.10.53 > 10.100.200.247.32941: 29732 0/1/0 (167)
09:29:03.351615 IP 10.100.200.247.39681 > 10.200.0.10.53: 12253+ A? pgbouncer-airflow-euw-dev-db.pgbouncer.svc.cluster.local. (74)
09:29:03.351679 IP 10.100.200.247.39681 > 10.200.0.10.53: 33703+ AAAA? pgbouncer-airflow-euw-dev-db.pgbouncer.svc.cluster.local. (74)
09:29:03.353492 IP 10.200.0.10.53 > 10.100.200.247.39681: 33703 0/1/0 (167)
09:29:03.353510 IP 10.200.0.10.53 > 10.100.200.247.39681: 12253 1/0/0 A 10.200.200.112 (146)
09:29:03.384336 IP 10.100.200.247.37325 > 10.200.0.10.53: 22537+ A? pgbouncer-airflow-euw-dev-db.pgbouncer.svc.cluster.local. (74)
09:29:03.384450 IP 10.100.200.247.37325 > 10.200.0.10.53: 26492+ AAAA? pgbouncer-airflow-euw-dev-db.pgbouncer.svc.cluster.local. (74)
09:29:03.389812 IP 10.200.0.10.53 > 10.100.200.247.37325: 26492 0/1/0 (167)
09:29:03.389865 IP 10.200.0.10.53 > 10.100.200.247.37325: 22537 1/0/0 A 10.200.200.112 (146)
09:29:03.423447 IP 10.100.200.247.58325 > 10.200.0.10.53: 7237+ A? pgbouncer-airflow-euw-dev-db.pgbouncer.svc.cluster.local. (74)
09:29:03.423554 IP 10.100.200.247.58325 > 10.200.0.10.53: 47900+ AAAA? pgbouncer-airflow-euw-dev-db.pgbouncer.svc.cluster.local. (74)
09:29:03.425626 IP 10.200.0.10.53 > 10.100.200.247.58325: 7237 1/0/0 A 10.200.200.112 (146)
09:29:03.425633 IP 10.200.0.10.53 > 10.100.200.247.58325: 47900 0/1/0 (167)
09:29:03.461069 IP 10.100.200.247.42199 > 10.200.0.10.53: 63777+ A? pgbouncer-airflow-euw-dev-db.pgbouncer.svc.cluster.local. (74)
09:29:03.461172 IP 10.100.200.247.42199 > 10.200.0.10.53: 59191+ AAAA? pgbouncer-airflow-euw-dev-db.pgbouncer.svc.cluster.local. (74)
09:29:03.463249 IP 10.200.0.10.53 > 10.100.200.247.42199: 59191 0/1/0 (167)
09:29:03.463278 IP 10.200.0.10.53 > 10.100.200.247.42199: 63777 1/0/0 A 10.200.200.112 (146)
09:29:03.508441 IP 10.100.200.247.48955 > 10.200.0.10.53: 26624+ A? pgbouncer-airflow-euw-dev-db.pgbouncer.svc.cluster.local. (74)
09:29:03.508563 IP 10.100.200.247.48955 > 10.200.0.10.53: 37340+ AAAA? pgbouncer-airflow-euw-dev-db.pgbouncer.svc.cluster.local. (74)
09:29:03.513215 IP 10.200.0.10.53 > 10.100.200.247.48955: 37340 0/1/0 (167)
09:29:03.513231 IP 10.200.0.10.53 > 10.100.200.247.48955: 26624 1/0/0 A 10.200.200.112 (146)
09:29:03.546612 IP 10.100.200.247.50226 > 10.200.0.10.53: 45416+ A? pgbouncer-airflow-euw-dev-db.pgbouncer.svc.cluster.local. (74)
09:29:03.546724 IP 10.100.200.247.50226 > 10.200.0.10.53: 1796+ AAAA? pgbouncer-airflow-euw-dev-db.pgbouncer.svc.cluster.local. (74)
09:29:03.548610 IP 10.200.0.10.53 > 10.100.200.247.50226: 1796 0/1/0 (167)
09:29:03.548669 IP 10.200.0.10.53 > 10.100.200.247.50226: 45416 1/0/0 A 10.200.200.112 (146)
09:29:03.579450 IP 10.100.200.247.34938 > 10.200.0.10.53: 34271+ A? pgbouncer-airflow-euw-dev-db.pgbouncer.svc.cluster.local. (74)
09:29:03.579580 IP 10.100.200.247.34938 > 10.200.0.10.53: 27853+ AAAA? pgbouncer-airflow-euw-dev-db.pgbouncer.svc.cluster.local. (74)
09:29:03.581486 IP 10.200.0.10.53 > 10.100.200.247.34938: 27853 0/1/0 (167)
09:29:03.581496 IP 10.200.0.10.53 > 10.100.200.247.34938: 34271 1/0/0 A 10.200.200.112 (146)
09:29:03.620784 IP 10.100.200.247.51419 > 10.200.0.10.53: 29230+ A? pgbouncer-airflow-euw-dev-db.pgbouncer.svc.cluster.local. (74)
09:29:03.620893 IP 10.100.200.247.51419 > 10.200.0.10.53: 49055+ AAAA? pgbouncer-airflow-euw-dev-db.pgbouncer.svc.cluster.local. (74)
09:29:03.624532 IP 10.200.0.10.53 > 10.100.200.247.51419: 49055 0/1/0 (167)
09:29:03.624550 IP 10.200.0.10.53 > 10.100.200.247.51419: 29230 1/0/0 A 10.200.200.112 (146)
09:29:03.658311 IP 10.100.200.247.59039 > 10.200.0.10.53: 9469+ A? pgbouncer-airflow-euw-dev-db.pgbouncer.svc.cluster.local. (74)
09:29:03.658421 IP 10.100.200.247.59039 > 10.200.0.10.53: 17771+ AAAA? pgbouncer-airflow-euw-dev-db.pgbouncer.svc.cluster.local. (74)
09:29:03.660305 IP 10.200.0.10.53 > 10.100.200.247.59039: 17771 0/1/0 (167)
09:29:03.660324 IP 10.200.0.10.53 > 10.100.200.247.59039: 9469 1/0/0 A 10.200.200.112 (146)
09:29:03.696982 IP 10.100.200.247.52479 > 10.200.0.10.53: 30417+ A? pgbouncer-airflow-euw-dev-db.pgbouncer.svc.cluster.local. (74)
09:29:03.697044 IP 10.100.200.247.52479 > 10.200.0.10.53: 32839+ AAAA? pgbouncer-airflow-euw-dev-db.pgbouncer.svc.cluster.local. (74)
09:29:03.699203 IP 10.200.0.10.53 > 10.100.200.247.52479: 30417 1/0/0 A 10.200.200.112 (146)
09:29:03.699211 IP 10.200.0.10.53 > 10.100.200.247.52479: 32839 0/1/0 (167)
09:29:03.729772 IP 10.100.200.247.39198 > 10.200.0.10.53: 54992+ A? pgbouncer-airflow-euw-dev-db.pgbouncer.svc.cluster.local. (74)
09:29:03.729856 IP 10.100.200.247.39198 > 10.200.0.10.53: 5482+ AAAA? pgbouncer-airflow-euw-dev-db.pgbouncer.svc.cluster.local. (74)
09:29:03.736196 IP 10.200.0.10.53 > 10.100.200.247.39198: 5482 0/1/0 (167)
09:29:03.736219 IP 10.200.0.10.53 > 10.100.200.247.39198: 54992 1/0/0 A 10.200.200.112 (146)
09:29:03.770409 IP 10.100.200.247.44339 > 10.200.0.10.53: 21345+ A? pgbouncer-airflow-euw-dev-db.pgbouncer.svc.cluster.local. (74)
09:29:03.770524 IP 10.100.200.247.44339 > 10.200.0.10.53: 52079+ AAAA? pgbouncer-airflow-euw-dev-db.pgbouncer.svc.cluster.local. (74)
09:29:03.772698 IP 10.200.0.10.53 > 10.100.200.247.44339: 21345 1/0/0 A 10.200.200.112 (146)
09:29:03.772717 IP 10.200.0.10.53 > 10.100.200.247.44339: 52079 0/1/0 (167)
09:29:03.808206 IP 10.100.200.247.35888 > 10.200.0.10.53: 32064+ A? pgbouncer-airflow-euw-dev-db.pgbouncer.svc.cluster.local. (74)
09:29:03.808324 IP 10.100.200.247.35888 > 10.200.0.10.53: 4130+ AAAA? pgbouncer-airflow-euw-dev-db.pgbouncer.svc.cluster.local. (74)
09:29:03.810343 IP 10.200.0.10.53 > 10.100.200.247.35888: 4130 0/1/0 (167)
09:29:03.810391 IP 10.200.0.10.53 > 10.100.200.247.35888: 32064 1/0/0 A 10.200.200.112 (146)
09:29:03.840161 IP 10.100.200.247.53691 > 10.200.0.10.53: 15855+ A? pgbouncer-airflow-euw-dev-db.pgbouncer.svc.cluster.local. (74)
09:29:03.840225 IP 10.100.200.247.53691 > 10.200.0.10.53: 9676+ AAAA? pgbouncer-airflow-euw-dev-db.pgbouncer.svc.cluster.local. (74)
09:29:03.842442 IP 10.200.0.10.53 > 10.100.200.247.53691: 9676 0/1/0 (167)
09:29:03.842444 IP 10.200.0.10.53 > 10.100.200.247.53691: 15855 1/0/0 A 10.200.200.112 (146)
09:29:03.878230 IP 10.100.200.247.55756 > 10.200.0.10.53: 39022+ A? pgbouncer-airflow-euw-dev-db.pgbouncer.svc.cluster.local. (74)
09:29:03.878314 IP 10.100.200.247.55756 > 10.200.0.10.53: 57632+ AAAA? pgbouncer-airflow-euw-dev-db.pgbouncer.svc.cluster.local. (74)
09:29:03.880682 IP 10.200.0.10.53 > 10.100.200.247.55756: 57632 0/1/0 (167)
09:29:03.880706 IP 10.200.0.10.53 > 10.100.200.247.55756: 39022 1/0/0 A 10.200.200.112 (146)
09:29:03.913559 IP 10.100.200.247.46065 > 10.200.0.10.53: 28382+ A? pgbouncer-airflow-euw-dev-db.pgbouncer.svc.cluster.local. (74)
09:29:03.913744 IP 10.100.200.247.46065 > 10.200.0.10.53: 171+ AAAA? pgbouncer-airflow-euw-dev-db.pgbouncer.svc.cluster.local. (74)
09:29:03.915772 IP 10.200.0.10.53 > 10.100.200.247.46065: 28382 1/0/0 A 10.200.200.112 (146)
09:29:03.915772 IP 10.200.0.10.53 > 10.100.200.247.46065: 171 0/1/0 (167)
09:29:03.956459 IP 10.100.200.247.56863 > 10.200.0.10.53: 34277+ A? pgbouncer-airflow-euw-dev-db.pgbouncer.svc.cluster.local. (74)
09:29:03.956532 IP 10.100.200.247.56863 > 10.200.0.10.53: 24878+ AAAA? pgbouncer-airflow-euw-dev-db.pgbouncer.svc.cluster.local. (74)
09:29:03.958477 IP 10.200.0.10.53 > 10.100.200.247.56863: 24878 0/1/0 (167)
09:29:03.958514 IP 10.200.0.10.53 > 10.100.200.247.56863: 34277 1/0/0 A 10.200.200.112 (146)
09:29:03.990049 IP 10.100.200.247.59055 > 10.200.0.10.53: 26101+ A? pgbouncer-airflow-euw-dev-db.pgbouncer.svc.cluster.local. (74)
09:29:03.990111 IP 10.100.200.247.59055 > 10.200.0.10.53: 20434+ AAAA? pgbouncer-airflow-euw-dev-db.pgbouncer.svc.cluster.local. (74)
09:29:03.992186 IP 10.200.0.10.53 > 10.100.200.247.59055: 20434 0/1/0 (167)
09:29:03.992215 IP 10.200.0.10.53 > 10.100.200.247.59055: 26101 1/0/0 A 10.200.200.112 (146)
09:29:04.024288 IP 10.100.200.247.42235 > 10.200.0.10.53: 42643+ A? pgbouncer-airflow-euw-dev-db.pgbouncer.svc.cluster.local. (74)
09:29:04.024365 IP 10.100.200.247.42235 > 10.200.0.10.53: 11876+ AAAA? pgbouncer-airflow-euw-dev-db.pgbouncer.svc.cluster.local. (74)
09:29:04.026528 IP 10.200.0.10.53 > 10.100.200.247.42235: 42643 1/0/0 A 10.200.200.112 (146)
09:29:04.026565 IP 10.200.0.10.53 > 10.100.200.247.42235: 11876 0/1/0 (167)
09:29:04.056426 IP 10.100.200.247.60928 > 10.200.0.10.53: 55972+ A? pgbouncer-airflow-euw-dev-db.pgbouncer.svc.cluster.local. (74)
09:29:04.056514 IP 10.100.200.247.60928 > 10.200.0.10.53: 56819+ AAAA? pgbouncer-airflow-euw-dev-db.pgbouncer.svc.cluster.local. (74)
09:29:04.058594 IP 10.200.0.10.53 > 10.100.200.247.60928: 56819 0/1/0 (167)
09:29:04.058603 IP 10.200.0.10.53 > 10.100.200.247.60928: 55972 1/0/0 A 10.200.200.112 (146)
09:29:04.091031 IP 10.100.200.247.35475 > 10.200.0.10.53: 48370+ A? pgbouncer-airflow-euw-dev-db.pgbouncer.svc.cluster.local. (74)
09:29:04.091166 IP 10.100.200.247.35475 > 10.200.0.10.53: 48649+ AAAA? pgbouncer-airflow-euw-dev-db.pgbouncer.svc.cluster.local. (74)
09:29:04.093224 IP 10.200.0.10.53 > 10.100.200.247.35475: 48649 0/1/0 (167)
09:29:04.093242 IP 10.200.0.10.53 > 10.100.200.247.35475: 48370 1/0/0 A 10.200.200.112 (146)
09:29:04.127173 IP 10.100.200.247.53950 > 10.200.0.10.53: 48475+ A? pgbouncer-airflow-euw-dev-db.pgbouncer.svc.cluster.local. (74)
09:29:04.127228 IP 10.100.200.247.53950 > 10.200.0.10.53: 5056+ AAAA? pgbouncer-airflow-euw-dev-db.pgbouncer.svc.cluster.local. (74)
09:29:04.128995 IP 10.200.0.10.53 > 10.100.200.247.53950: 5056 0/1/0 (167)
09:29:04.129024 IP 10.200.0.10.53 > 10.100.200.247.53950: 48475 1/0/0 A 10.200.200.112 (146)
09:29:04.162835 IP 10.100.200.247.50336 > 10.200.0.10.53: 15041+ A? pgbouncer-airflow-euw-dev-db.pgbouncer.svc.cluster.local. (74)
09:29:04.162891 IP 10.100.200.247.50336 > 10.200.0.10.53: 29904+ AAAA? pgbouncer-airflow-euw-dev-db.pgbouncer.svc.cluster.local. (74)
09:29:04.164778 IP 10.200.0.10.53 > 10.100.200.247.50336: 29904 0/1/0 (167)
09:29:04.164793 IP 10.200.0.10.53 > 10.100.200.247.50336: 15041 1/0/0 A 10.200.200.112 (146)
09:29:04.195368 IP 10.100.200.247.52489 > 10.200.0.10.53: 241+ A? pgbouncer-airflow-euw-dev-db.pgbouncer.svc.cluster.local. (74)
09:29:04.195433 IP 10.100.200.247.52489 > 10.200.0.10.53: 23840+ AAAA? pgbouncer-airflow-euw-dev-db.pgbouncer.svc.cluster.local. (74)
09:29:04.197531 IP 10.200.0.10.53 > 10.100.200.247.52489: 23840 0/1/0 (167)
09:29:04.197592 IP 10.200.0.10.53 > 10.100.200.247.52489: 241 1/0/0 A 10.200.200.112 (146)
09:29:04.227582 IP 10.100.200.247.48775 > 10.200.0.10.53: 31296+ A? pgbouncer-airflow-euw-dev-db.pgbouncer.svc.cluster.local. (74)
09:29:04.227652 IP 10.100.200.247.48775 > 10.200.0.10.53: 11630+ AAAA? pgbouncer-airflow-euw-dev-db.pgbouncer.svc.cluster.local. (74)
09:29:04.229950 IP 10.200.0.10.53 > 10.100.200.247.48775: 11630 0/1/0 (167)
09:29:04.230034 IP 10.200.0.10.53 > 10.100.200.247.48775: 31296 1/0/0 A 10.200.200.112 (146)
09:29:04.258871 IP 10.100.200.247.51828 > 10.200.0.10.53: 1564+ A? pgbouncer-airflow-euw-dev-db.pgbouncer.svc.cluster.local. (74)
09:29:04.258936 IP 10.100.200.247.51828 > 10.200.0.10.53: 45268+ AAAA? pgbouncer-airflow-euw-dev-db.pgbouncer.svc.cluster.local. (74)
09:29:04.260867 IP 10.200.0.10.53 > 10.100.200.247.51828: 45268 0/1/0 (167)
09:29:04.260883 IP 10.200.0.10.53 > 10.100.200.247.51828: 1564 1/0/0 A 10.200.200.112 (146)
09:29:04.290596 IP 10.100.200.247.49296 > 10.200.0.10.53: 10363+ A? pgbouncer-airflow-euw-dev-db.pgbouncer.svc.cluster.local. (74)
09:29:04.290777 IP 10.100.200.247.49296 > 10.200.0.10.53: 8750+ AAAA? pgbouncer-airflow-euw-dev-db.pgbouncer.svc.cluster.local. (74)
09:29:04.292805 IP 10.200.0.10.53 > 10.100.200.247.49296: 10363 1/0/0 A 10.200.200.112 (146)
09:29:04.292824 IP 10.200.0.10.53 > 10.100.200.247.49296: 8750 0/1/0 (167)
09:29:04.320554 IP 10.100.200.247.52871 > 10.200.0.10.53: 27064+ A? pgbouncer-airflow-euw-dev-db.pgbouncer.svc.cluster.local. (74)
09:29:04.320670 IP 10.100.200.247.52871 > 10.200.0.10.53: 1098+ AAAA? pgbouncer-airflow-euw-dev-db.pgbouncer.svc.cluster.local. (74)
09:29:04.322784 IP 10.200.0.10.53 > 10.100.200.247.52871: 27064 1/0/0 A 10.200.200.112 (146)
09:29:04.322845 IP 10.200.0.10.53 > 10.100.200.247.52871: 1098 0/1/0 (167)
09:29:04.358155 IP 10.100.200.247.34846 > 10.200.0.10.53: 31516+ A? pgbouncer-airflow-euw-dev-db.pgbouncer.svc.cluster.local. (74)
09:29:04.358236 IP 10.100.200.247.34846 > 10.200.0.10.53: 33532+ AAAA? pgbouncer-airflow-euw-dev-db.pgbouncer.svc.cluster.local. (74)
09:29:04.360178 IP 10.200.0.10.53 > 10.100.200.247.34846: 33532 0/1/0 (167)
09:29:04.360184 IP 10.200.0.10.53 > 10.100.200.247.34846: 31516 1/0/0 A 10.200.200.112 (146)
09:29:04.395234 IP 10.100.200.247.41301 > 10.200.0.10.53: 45514+ A? pgbouncer-airflow-euw-dev-db.pgbouncer.svc.cluster.local. (74)
09:29:04.395327 IP 10.100.200.247.41301 > 10.200.0.10.53: 8875+ AAAA? pgbouncer-airflow-euw-dev-db.pgbouncer.svc.cluster.local. (74)
09:29:04.397512 IP 10.200.0.10.53 > 10.100.200.247.41301: 8875 0/1/0 (167)
09:29:04.397520 IP 10.200.0.10.53 > 10.100.200.247.41301: 45514 1/0/0 A 10.200.200.112 (146)
09:29:04.427668 IP 10.100.200.247.60637 > 10.200.0.10.53: 35509+ A? pgbouncer-airflow-euw-dev-db.pgbouncer.svc.cluster.local. (74)
09:29:04.427848 IP 10.100.200.247.60637 > 10.200.0.10.53: 34759+ AAAA? pgbouncer-airflow-euw-dev-db.pgbouncer.svc.cluster.local. (74)
09:29:04.429773 IP 10.200.0.10.53 > 10.100.200.247.60637: 34759 0/1/0 (167)
09:29:04.429787 IP 10.200.0.10.53 > 10.100.200.247.60637: 35509 1/0/0 A 10.200.200.112 (146)
09:29:04.460853 IP 10.100.200.247.50550 > 10.200.0.10.53: 7293+ A? pgbouncer-airflow-euw-dev-db.pgbouncer.svc.cluster.local. (74)
09:29:04.461128 IP 10.100.200.247.50550 > 10.200.0.10.53: 41790+ AAAA? pgbouncer-airflow-euw-dev-db.pgbouncer.svc.cluster.local. (74)
09:29:04.462821 IP 10.200.0.10.53 > 10.100.200.247.50550: 41790 0/1/0 (167)
09:29:04.462840 IP 10.200.0.10.53 > 10.100.200.247.50550: 7293 1/0/0 A 10.200.200.112 (146)
09:29:04.493233 IP 10.100.200.247.55745 > 10.200.0.10.53: 280+ A? pgbouncer-airflow-euw-dev-db.pgbouncer.svc.cluster.local. (74)
09:29:04.493278 IP 10.100.200.247.55745 > 10.200.0.10.53: 28152+ AAAA? pgbouncer-airflow-euw-dev-db.pgbouncer.svc.cluster.local. (74)
09:29:04.495556 IP 10.200.0.10.53 > 10.100.200.247.55745: 28152 0/1/0 (167)
09:29:04.495570 IP 10.200.0.10.53 > 10.100.200.247.55745: 280 1/0/0 A 10.200.200.112 (146)
09:29:04.529125 IP 10.100.200.247.53446 > 10.200.0.10.53: 18482+ A? pgbouncer-airflow-euw-dev-db.pgbouncer.svc.cluster.local. (74)
09:29:04.529192 IP 10.100.200.247.53446 > 10.200.0.10.53: 41331+ AAAA? pgbouncer-airflow-euw-dev-db.pgbouncer.svc.cluster.local. (74)
09:29:04.531340 IP 10.200.0.10.53 > 10.100.200.247.53446: 18482 1/0/0 A 10.200.200.112 (146)
09:29:04.531349 IP 10.200.0.10.53 > 10.100.200.247.53446: 41331 0/1/0 (167)
09:29:04.560160 IP 10.100.200.247.57828 > 10.200.0.10.53: 36266+ A? pgbouncer-airflow-euw-dev-db.pgbouncer.svc.cluster.local. (74)
09:29:04.560266 IP 10.100.200.247.57828 > 10.200.0.10.53: 4590+ AAAA? pgbouncer-airflow-euw-dev-db.pgbouncer.svc.cluster.local. (74)
09:29:04.562394 IP 10.200.0.10.53 > 10.100.200.247.57828: 4590 0/1/0 (167)
09:29:04.562402 IP 10.200.0.10.53 > 10.100.200.247.57828: 36266 1/0/0 A 10.200.200.112 (146)
09:29:04.593423 IP 10.100.200.247.58706 > 10.200.0.10.53: 13976+ A? pgbouncer-airflow-euw-dev-db.pgbouncer.svc.cluster.local. (74)
09:29:04.594360 IP 10.100.200.247.58706 > 10.200.0.10.53: 40529+ AAAA? pgbouncer-airflow-euw-dev-db.pgbouncer.svc.cluster.local. (74)
09:29:04.596286 IP 10.200.0.10.53 > 10.100.200.247.58706: 40529 0/1/0 (167)
09:29:04.596310 IP 10.200.0.10.53 > 10.100.200.247.58706: 13976 1/0/0 A 10.200.200.112 (146)
09:29:04.627047 IP 10.100.200.247.39990 > 10.200.0.10.53: 17495+ A? pgbouncer-airflow-euw-dev-db.pgbouncer.svc.cluster.local. (74)
09:29:04.627106 IP 10.100.200.247.39990 > 10.200.0.10.53: 11113+ AAAA? pgbouncer-airflow-euw-dev-db.pgbouncer.svc.cluster.local. (74)
09:29:04.629230 IP 10.200.0.10.53 > 10.100.200.247.39990: 11113 0/1/0 (167)
09:29:04.629247 IP 10.200.0.10.53 > 10.100.200.247.39990: 17495 1/0/0 A 10.200.200.112 (146)
09:29:04.658725 IP 10.100.200.247.60578 > 10.200.0.10.53: 53660+ A? pgbouncer-airflow-euw-dev-db.pgbouncer.svc.cluster.local. (74)
09:29:04.658784 IP 10.100.200.247.60578 > 10.200.0.10.53: 5339+ AAAA? pgbouncer-airflow-euw-dev-db.pgbouncer.svc.cluster.local. (74)
09:29:04.660733 IP 10.200.0.10.53 > 10.100.200.247.60578: 5339 0/1/0 (167)
09:29:04.660750 IP 10.200.0.10.53 > 10.100.200.247.60578: 53660 1/0/0 A 10.200.200.112 (146)
09:29:04.698268 IP 10.100.200.247.51335 > 10.200.0.10.53: 41126+ A? pgbouncer-airflow-euw-dev-db.pgbouncer.svc.cluster.local. (74)
09:29:04.698336 IP 10.100.200.247.51335 > 10.200.0.10.53: 14460+ AAAA? pgbouncer-airflow-euw-dev-db.pgbouncer.svc.cluster.local. (74)
09:29:04.700490 IP 10.200.0.10.53 > 10.100.200.247.51335: 14460 0/1/0 (167)
09:29:04.700504 IP 10.200.0.10.53 > 10.100.200.247.51335: 41126 1/0/0 A 10.200.200.112 (146)
09:29:04.730245 IP 10.100.200.247.53980 > 10.200.0.10.53: 44778+ A? pgbouncer-airflow-euw-dev-db.pgbouncer.svc.cluster.local. (74)
09:29:04.730296 IP 10.100.200.247.53980 > 10.200.0.10.53: 7792+ AAAA? pgbouncer-airflow-euw-dev-db.pgbouncer.svc.cluster.local. (74)
09:29:04.732484 IP 10.200.0.10.53 > 10.100.200.247.53980: 7792 0/1/0 (167)
09:29:04.732500 IP 10.200.0.10.53 > 10.100.200.247.53980: 44778 1/0/0 A 10.200.200.112 (146)
09:29:04.762557 IP 10.100.200.247.36064 > 10.200.0.10.53: 18263+ A? pgbouncer-airflow-euw-dev-db.pgbouncer.svc.cluster.local. (74)
09:29:04.762662 IP 10.100.200.247.36064 > 10.200.0.10.53: 19526+ AAAA? pgbouncer-airflow-euw-dev-db.pgbouncer.svc.cluster.local. (74)
09:29:04.764722 IP 10.200.0.10.53 > 10.100.200.247.36064: 18263 1/0/0 A 10.200.200.112 (146)
09:29:04.764741 IP 10.200.0.10.53 > 10.100.200.247.36064: 19526 0/1/0 (167)
09:29:04.794430 IP 10.100.200.247.43162 > 10.200.0.10.53: 51491+ A? pgbouncer-airflow-euw-dev-db.pgbouncer.svc.cluster.local. (74)
09:29:04.794483 IP 10.100.200.247.43162 > 10.200.0.10.53: 51208+ AAAA? pgbouncer-airflow-euw-dev-db.pgbouncer.svc.cluster.local. (74)
09:29:04.796799 IP 10.200.0.10.53 > 10.100.200.247.43162: 51208 0/1/0 (167)
09:29:04.796809 IP 10.200.0.10.53 > 10.100.200.247.43162: 51491 1/0/0 A 10.200.200.112 (146)
09:29:04.830112 IP 10.100.200.247.59705 > 10.200.0.10.53: 7222+ A? pgbouncer-airflow-euw-dev-db.pgbouncer.svc.cluster.local. (74)
09:29:04.830173 IP 10.100.200.247.59705 > 10.200.0.10.53: 39534+ AAAA? pgbouncer-airflow-euw-dev-db.pgbouncer.svc.cluster.local. (74)
09:29:04.832095 IP 10.200.0.10.53 > 10.100.200.247.59705: 39534 0/1/0 (167)
09:29:04.832121 IP 10.200.0.10.53 > 10.100.200.247.59705: 7222 1/0/0 A 10.200.200.112 (146)
09:29:04.863247 IP 10.100.200.247.51086 > 10.200.0.10.53: 8622+ A? pgbouncer-airflow-euw-dev-db.pgbouncer.svc.cluster.local. (74)
09:29:04.863323 IP 10.100.200.247.51086 > 10.200.0.10.53: 30456+ AAAA? pgbouncer-airflow-euw-dev-db.pgbouncer.svc.cluster.local. (74)
09:29:04.865227 IP 10.200.0.10.53 > 10.100.200.247.51086: 30456 0/1/0 (167)
09:29:04.865280 IP 10.200.0.10.53 > 10.100.200.247.51086: 8622 1/0/0 A 10.200.200.112 (146)
09:29:04.902893 IP 10.100.200.247.52675 > 10.200.0.10.53: 41463+ A? pgbouncer-airflow-euw-dev-db.pgbouncer.svc.cluster.local. (74)
09:29:04.903015 IP 10.100.200.247.52675 > 10.200.0.10.53: 61705+ AAAA? pgbouncer-airflow-euw-dev-db.pgbouncer.svc.cluster.local. (74)
09:29:04.904918 IP 10.200.0.10.53 > 10.100.200.247.52675: 61705 0/1/0 (167)
09:29:04.904938 IP 10.200.0.10.53 > 10.100.200.247.52675: 41463 1/0/0 A 10.200.200.112 (146)
09:29:04.939312 IP 10.100.200.247.43877 > 10.200.0.10.53: 46170+ A? pgbouncer-airflow-euw-dev-db.pgbouncer.svc.cluster.local. (74)
09:29:04.939381 IP 10.100.200.247.43877 > 10.200.0.10.53: 20161+ AAAA? pgbouncer-airflow-euw-dev-db.pgbouncer.svc.cluster.local. (74)
09:29:04.941307 IP 10.200.0.10.53 > 10.100.200.247.43877: 20161 0/1/0 (167)
09:29:04.941334 IP 10.200.0.10.53 > 10.100.200.247.43877: 46170 1/0/0 A 10.200.200.112 (146)
09:29:04.974039 IP 10.100.200.247.37947 > 10.200.0.10.53: 47049+ A? pgbouncer-airflow-euw-dev-db.pgbouncer.svc.cluster.local. (74)
09:29:04.974168 IP 10.100.200.247.37947 > 10.200.0.10.53: 4327+ AAAA? pgbouncer-airflow-euw-dev-db.pgbouncer.svc.cluster.local. (74)
09:29:04.976328 IP 10.200.0.10.53 > 10.100.200.247.37947: 4327 0/1/0 (167)
09:29:04.976344 IP 10.200.0.10.53 > 10.100.200.247.37947: 47049 1/0/0 A 10.200.200.112 (146)
09:29:05.005534 IP 10.100.200.247.53855 > 10.200.0.10.53: 48702+ A? pgbouncer-airflow-euw-dev-db.pgbouncer.svc.cluster.local. (74)
09:29:05.005601 IP 10.100.200.247.53855 > 10.200.0.10.53: 35490+ AAAA? pgbouncer-airflow-euw-dev-db.pgbouncer.svc.cluster.local. (74)
09:29:05.007524 IP 10.200.0.10.53 > 10.100.200.247.53855: 35490 0/1/0 (167)
09:29:05.007540 IP 10.200.0.10.53 > 10.100.200.247.53855: 48702 1/0/0 A 10.200.200.112 (146)
09:29:05.036977 IP 10.100.200.247.55778 > 10.200.0.10.53: 37088+ A? pgbouncer-airflow-euw-dev-db.pgbouncer.svc.cluster.local. (74)
09:29:05.037130 IP 10.100.200.247.55778 > 10.200.0.10.53: 30247+ AAAA? pgbouncer-airflow-euw-dev-db.pgbouncer.svc.cluster.local. (74)
09:29:05.038948 IP 10.200.0.10.53 > 10.100.200.247.55778: 30247 0/1/0 (167)
09:29:05.038964 IP 10.200.0.10.53 > 10.100.200.247.55778: 37088 1/0/0 A 10.200.200.112 (146)
09:29:05.068368 IP 10.100.200.247.35734 > 10.200.0.10.53: 891+ A? pgbouncer-airflow-euw-dev-db.pgbouncer.svc.cluster.local. (74)
09:29:05.068428 IP 10.100.200.247.35734 > 10.200.0.10.53: 38618+ AAAA? pgbouncer-airflow-euw-dev-db.pgbouncer.svc.cluster.local. (74)
09:29:05.070408 IP 10.200.0.10.53 > 10.100.200.247.35734: 38618 0/1/0 (167)
09:29:05.070441 IP 10.200.0.10.53 > 10.100.200.247.35734: 891 1/0/0 A 10.200.200.112 (146)
09:29:05.099094 IP 10.100.200.247.34884 > 10.200.0.10.53: 20510+ A? pgbouncer-airflow-euw-dev-db.pgbouncer.svc.cluster.local. (74)
09:29:05.099149 IP 10.100.200.247.34884 > 10.200.0.10.53: 37994+ AAAA? pgbouncer-airflow-euw-dev-db.pgbouncer.svc.cluster.local. (74)
09:29:05.100857 IP 10.200.0.10.53 > 10.100.200.247.34884: 37994 0/1/0 (167)
09:29:05.100869 IP 10.200.0.10.53 > 10.100.200.247.34884: 20510 1/0/0 A 10.200.200.112 (146)
09:29:05.129352 IP 10.100.200.247.43220 > 10.200.0.10.53: 47057+ A? pgbouncer-airflow-euw-dev-db.pgbouncer.svc.cluster.local. (74)
09:29:05.129463 IP 10.100.200.247.43220 > 10.200.0.10.53: 45641+ AAAA? pgbouncer-airflow-euw-dev-db.pgbouncer.svc.cluster.local. (74)
09:29:05.131334 IP 10.200.0.10.53 > 10.100.200.247.43220: 47057 1/0/0 A 10.200.200.112 (146)
09:29:05.131334 IP 10.200.0.10.53 > 10.100.200.247.43220: 45641 0/1/0 (167)
09:29:05.162445 IP 10.100.200.247.39097 > 10.200.0.10.53: 29929+ A? pgbouncer-airflow-euw-dev-db.pgbouncer.svc.cluster.local. (74)
09:29:05.162577 IP 10.100.200.247.39097 > 10.200.0.10.53: 47259+ AAAA? pgbouncer-airflow-euw-dev-db.pgbouncer.svc.cluster.local. (74)
09:29:05.164952 IP 10.200.0.10.53 > 10.100.200.247.39097: 47259 0/1/0 (167)
09:29:05.164969 IP 10.200.0.10.53 > 10.100.200.247.39097: 29929 1/0/0 A 10.200.200.112 (146)
09:29:05.208536 IP 10.100.200.247.56944 > 10.200.0.10.53: 19237+ A? pgbouncer-airflow-euw-dev-db.pgbouncer.svc.cluster.local. (74)
09:29:05.208654 IP 10.100.200.247.56944 > 10.200.0.10.53: 27590+ AAAA? pgbouncer-airflow-euw-dev-db.pgbouncer.svc.cluster.local. (74)
09:29:05.210409 IP 10.200.0.10.53 > 10.100.200.247.56944: 19237 1/0/0 A 10.200.200.112 (146)
09:29:05.210423 IP 10.200.0.10.53 > 10.100.200.247.56944: 27590 0/1/0 (167)
09:29:05.241735 IP 10.100.200.247.37652 > 10.200.0.10.53: 40442+ A? pgbouncer-airflow-euw-dev-db.pgbouncer.svc.cluster.local. (74)
09:29:05.241798 IP 10.100.200.247.37652 > 10.200.0.10.53: 55614+ AAAA? pgbouncer-airflow-euw-dev-db.pgbouncer.svc.cluster.local. (74)
09:29:05.243716 IP 10.200.0.10.53 > 10.100.200.247.37652: 40442 1/0/0 A 10.200.200.112 (146)
09:29:05.243731 IP 10.200.0.10.53 > 10.100.200.247.37652: 55614 0/1/0 (167)
09:29:05.274203 IP 10.100.200.247.53440 > 10.200.0.10.53: 40034+ A? pgbouncer-airflow-euw-dev-db.pgbouncer.svc.cluster.local. (74)
09:29:05.274309 IP 10.100.200.247.53440 > 10.200.0.10.53: 24984+ AAAA? pgbouncer-airflow-euw-dev-db.pgbouncer.svc.cluster.local. (74)
09:29:05.276305 IP 10.200.0.10.53 > 10.100.200.247.53440: 24984 0/1/0 (167)
09:29:05.276322 IP 10.200.0.10.53 > 10.100.200.247.53440: 40034 1/0/0 A 10.200.200.112 (146)
09:29:05.309454 IP 10.100.200.247.47106 > 10.200.0.10.53: 29181+ A? pgbouncer-airflow-euw-dev-db.pgbouncer.svc.cluster.local. (74)
09:29:05.309570 IP 10.100.200.247.47106 > 10.200.0.10.53: 57716+ AAAA? pgbouncer-airflow-euw-dev-db.pgbouncer.svc.cluster.local. (74)
09:29:05.311412 IP 10.200.0.10.53 > 10.100.200.247.47106: 29181 1/0/0 A 10.200.200.112 (146)
09:29:05.311430 IP 10.200.0.10.53 > 10.100.200.247.47106: 57716 0/1/0 (167)
09:29:05.351967 IP 10.100.200.247.39189 > 10.200.0.10.53: 36173+ A? pgbouncer-airflow-euw-dev-db.pgbouncer.svc.cluster.local. (74)
09:29:05.352096 IP 10.100.200.247.39189 > 10.200.0.10.53: 33846+ AAAA? pgbouncer-airflow-euw-dev-db.pgbouncer.svc.cluster.local. (74)
09:29:05.354058 IP 10.200.0.10.53 > 10.100.200.247.39189: 36173 1/0/0 A 10.200.200.112 (146)
09:29:05.354061 IP 10.200.0.10.53 > 10.100.200.247.39189: 33846 0/1/0 (167)
09:29:05.383533 IP 10.100.200.247.39844 > 10.200.0.10.53: 29021+ A? pgbouncer-airflow-euw-dev-db.pgbouncer.svc.cluster.local. (74)
09:29:05.383704 IP 10.100.200.247.39844 > 10.200.0.10.53: 3476+ AAAA? pgbouncer-airflow-euw-dev-db.pgbouncer.svc.cluster.local. (74)
09:29:05.385557 IP 10.200.0.10.53 > 10.100.200.247.39844: 3476 0/1/0 (167)
09:29:05.385574 IP 10.200.0.10.53 > 10.100.200.247.39844: 29021 1/0/0 A 10.200.200.112 (146)
09:29:05.416524 IP 10.100.200.247.37502 > 10.200.0.10.53: 47174+ A? pgbouncer-airflow-euw-dev-db.pgbouncer.svc.cluster.local. (74)
09:29:05.416587 IP 10.100.200.247.37502 > 10.200.0.10.53: 31002+ AAAA? pgbouncer-airflow-euw-dev-db.pgbouncer.svc.cluster.local. (74)
09:29:05.418527 IP 10.200.0.10.53 > 10.100.200.247.37502: 31002 0/1/0 (167)
09:29:05.418535 IP 10.200.0.10.53 > 10.100.200.247.37502: 47174 1/0/0 A 10.200.200.112 (146)
09:29:05.451898 IP 10.100.200.247.33027 > 10.200.0.10.53: 40676+ A? pgbouncer-airflow-euw-dev-db.pgbouncer.svc.cluster.local. (74)
09:29:05.451999 IP 10.100.200.247.33027 > 10.200.0.10.53: 20414+ AAAA? pgbouncer-airflow-euw-dev-db.pgbouncer.svc.cluster.local. (74)
09:29:05.453797 IP 10.200.0.10.53 > 10.100.200.247.33027: 40676 1/0/0 A 10.200.200.112 (146)
09:29:05.453806 IP 10.200.0.10.53 > 10.100.200.247.33027: 20414 0/1/0 (167)
09:29:05.491559 IP 10.100.200.247.45344 > 10.200.0.10.53: 21154+ A? pgbouncer-airflow-euw-dev-db.pgbouncer.svc.cluster.local. (74)
09:29:05.491721 IP 10.100.200.247.45344 > 10.200.0.10.53: 41882+ AAAA? pgbouncer-airflow-euw-dev-db.pgbouncer.svc.cluster.local. (74)
09:29:05.493526 IP 10.200.0.10.53 > 10.100.200.247.45344: 41882 0/1/0 (167)
09:29:05.493548 IP 10.200.0.10.53 > 10.100.200.247.45344: 21154 1/0/0 A 10.200.200.112 (146)
```

</p>
</details>

**Comment by sylr** [comment]
Turning off the pgbouncer makes the endpoint  `/static/bootstrap-toggle.min.js` unresponsive.

**Comment by ashb** [comment]
Which DNS pod (kube-dns or core-dns?) are you using in your kube cluster?

**Comment by sylr** [comment]
coredns

**Comment by vishal-swarankar-sdl** [comment]
I am also hitting the exact same issue? do we have an update on this issue? @ashb @sylr

**Comment by sylr** [comment]
Nope, I'm at lost here.

**Comment by natemoseman** [comment]
I had a similar issue with airflow running on kubernetes cluster that I was, fortunately, able to solve. 

Regular HTTP connections were taking a minimal of 5 seconds to complete.  Even using curl to fetch static content, like a CSS file, was taking 5 seconds.   When looking at the logs of the airflow web process it didn't show anything.  Although following them 'realtime' showed that the GET was showing up in the logs with the same 5 second delays as the curl command was taking.

by-passing everything and running curl directly from the container, and thus by-passing all the kubernetes networking stuff, was still having the delays. 

It took me a few days to realize what was going on with my setup.

As it turned out it was due to the 'type: LoadBalancer' service I was using to expose the airflow webserver to outside the cluster.  The loadbalancer was a external network load balancer that connected to the service via NodePort on each virtual machine in the node.   For whatever reason this meant that there was a large number of connections just kept open to the webserver at any time.   

In a 20 node cluster this meant 20 connections.  

So when I killed the LoadBalancer service and started using nginx-ingress instead then the problem instantly resolved itself.   No more delays.  Admin web UI went back to normal.

I am not exactly sure what was going on here. But I suspect that having a large number of connections always open was causing gunicorn process to delay routing new connections to the pool of webserver worker processes.   I was only using 4 processes at the time. 

So if you are seeing these strange 5 second delays then use netstat or similar tool to count the number of "ESTABLISHED" connections to the webserver process.   If you have a lot of connections and you are using service 'type: LoadBalancer' then try switching to using a ingress controller.   Also increasing the number of worker processes to exceed the number of established connections will probably work too.

Hope that helps.

**Comment by vishal-swarankar-sdl** [comment]
I had the flexibility of updating the k8s cluster to 1.16.5, and that solved this issue for me.

**Comment by sylr** [comment]
@natemoseman Thank you for your insights, I will take a look as soon as I get back to work.

**Comment by danielnazareth89** [comment]
I fixed this by changing the default worker gunicorn from **sync** to an asynchronous class namely **gevent**. Please see the below AWS thread for the weird behaviour between gunicorn and ELB's. 

[https://forums.aws.amazon.com/thread.jspa?messageID=419138](url)

So, simply set AIRFLOW__WEBSERVER__WORKER_CLASS: "gevent" in your config, should be better

**Comment by adamo57** [comment]
this also worked for me @danielnazareth89 thank you!!!!

**Comment by isabo-lululemon** [comment]
hey @danielnazareth89. i tried the method you've proposed but unfortunately the webserver pods won't even come up if i add that property. do you have any other ideas on how I could improve the speed of the Airflow UI? thanks!

**Comment by teastburn** [comment]
@isabo-lululemon you may need to install gevent if you didn't already `pip install gevent`

**Comment by ashb** [comment]
Is anyone able to give us a minimal reproduction case that I can run to debug this?

**Comment by haidernitc** [comment]
> @isabo-lululemon you may need to install gevent if you didn't already `pip install gevent`
Unfortunaltely, changing the working gunicorn to `gevent`  not helped me.

**Comment by Madaditya** [comment]
This is happening to me too. 

@ashb : Sharing my setup to provide details for reproduction.

**Kubernetes** : Azure Kubernetes Service (AKS).  v1.18.4
**Airflow version** : 2.0.1
Airflow exposed as LoadBalancer IP in Kubernetes > comes out a Azure load balancer. 
Airflow helm used : https://github.com/apache/airflow/tree/master/chart 

Screen below : (Shows every element on the html takes ~5 second to load)
![image](https://user-images.githubusercontent.com/2889089/119524696-7f677800-bd9b-11eb-96db-46c8d97e3a8d.png)

**Comment by potiuk** [comment]
Honestly it looks like some kind of connectivity/configuration problem of your browser/system configuration (and it's very similar with the original request of @sylr). If you look at @sylr screenshot - not only static code there takes ~5s to load but it also takes as long when those are   "cached" already. Also, if you look at the times they are all very similar to each other and for me it looks like this is in an issue with either browser or something on the way - but not Airflow itself.

I'd say you should look at some of your deployment configuration.

In order to verify it, just take a look at logs of the webserver. By default it should show all the requests it gets and how long it took to process them.

The 5/10 seconds delays seem indeed suspiciously like DNS timeout. One thing that COULD happen is indeed DNS timeout if the server or your proxty is trying to run reverse-DNS query on your IP address. I've seen this happening when the server was trying to put names against the IP addresses in the logs but the DNS hanged with timeout on the reverse DNS call. Disabling the IP-> name mapping in the place it's being run should help. 

Quoting @ashb : "It's DNS. It's always DNS."

**Comment by rafraph** [comment]
I think in my case it also was DNS issue since when I use the IP instead of the URL the UI become very fast

**Comment by ashb** [comment]
It's _always_ DNS.

Even when you think it's not DNS and you check for DNS problems, it's always DNS problems.

**Comment by jcborras** [comment]
FWIW:
I encountered a similar issue lately which could be traced to slow HTTP responses when requesting resources `/dag_stats` and `/task_stats`. The culprit is the database query which under certain circumstances (namely large number of rows and large number of active DAGs) it shows a) long response time and b) low susceptibility to optimization.
This situation has a bad fix though: DB query ops are done through the ORM which in turn makes a poor job writing SQL code under the circumstances above.

**Comment by nshetty15** [comment]
> 

This solution helped me.
Moved from Load balancer service to Ingress. Airflow UI runs perfectly fine without any delays.

**Comment by dimon222** [comment]
@lovishchaudhary-dd 
https://airflow.apache.org/docs/apache-airflow/stable/configurations-ref.html#worker-class
Set the env variable for monkeypatching before launching airflow.

**Comment by aswathinj-pai** [comment]
@dimon222 I'm still encountering the issue even after setting `AIRFLOW__WEBSERVER__WORKER_CLASS` to `'gevent'` and `_AIRFLOW_PATCH_GEVENT` to `1`. The logs continue to show a `RecursionError: maximum recursion depth exceeded`.

**Comment by dimon222** [comment]
@aswathinj-pai what version of airflow? is it happening in webserver?

**Comment by aswathinj-pai** [comment]
@dimon222 The airflow version is 2.4.3. The Log issue is happening for all the dags in the airflow.

**Comment by potiuk** [comment]
Look at the release notes. I believe there was a similiar issue fixed some 1.5 years ago in Airflow 2.5 or 2.6. it is so long ago that only release notes can tell you for sure - but I would strongly recommend you to upgrade to latest t version of airflow (2.10.2) as you are missing on literally thousands of bug fixes applied sice  - not mentioning a number of security issues that were fixed since your version.

**Comment by dimon222** [comment]
> @dimon222 The airflow version is 2.4.3. The Log issue is happening for all the dags in the airflow.

this flag for monkeypatching was introduced in 2.5.1
https://github.com/apache/airflow/pull/28283

**Comment by aswathinj-pai** [comment]
@dimon222 @potiuk . Thank you for the input. I'll pass this along to my team.

**Comment by EugeneBad** [comment]
We had a similar experience, but the cause turned out to be the database backend. Airflow makes a database call(s) for most web requests including the admin UI; to fetch static assets. If the database is already slow, then this impact will be cascaded upstream.

In our case, we had a long-running DAG with a locking SQL query being run from multiple airflow pods. This left many open connections, and a high DBLoad.
AWS RDS' "Performance Insights" makes it easy to assess the database's health, and diagnose such issues.

Removing this query restored the UI's performance. Hope this helps someone.
